APH1A	PROTEIN	Q96BI3	UNIPROT	PSEN1	PROTEIN	P49768	UNIPROT	Activates	Binding			9606;9606							12297508	YES	Gamma secretase subunit that leads to PS1/PS2 eterodimer complex stabilisation.	By using co-immunoprecipitation and nickel affinity pull-down approaches, we now show that mammalian aph-1 (maph-1), a conserved multipass membrane protein, physically associates with nicastrin and the heterodimers of the presenilin amino- and carboxyl-terminal fragments in human cell lines and in rat brain.	SIGNOR-83201	Notch_and_Myogenesis
NOTCH1	PROTEIN	P46531	UNIPROT	HES1	PROTEIN	Q14469	UNIPROT	Activates	Transcriptional activation			9606;9606							19165418	NO		Several lines of evidence have suggested that these genes are indeed direct notch target genes: a) the promoters of hes1, hes5 and hes7 as well as hey1, hey2 and heyl subfamily of hes, related with yrpw motif) can be activated by a constitutive active form of notch1.	SIGNOR-103519	Notch_and_Myogenesis
INSR	PROTEIN	P06213	UNIPROT	INSR	PROTEIN	P06213	UNIPROT	Inactivates	Phosphorylation	Tyr1011	DVFPCSVyVPDEWEV	9606;9606							12707268	YES		Two compounds capable of stimulating insulin receptor autophosphorylation by acting on the cytoplasmic domain have been reported	SIGNOR-39343	insulin_receptor
AKT1	PROTEIN	P31749	UNIPROT	MTOR	PROTEIN	P42345	UNIPROT	Activates	Phosphorylation	Thr2446		9606;9606							10910062	YES			SIGNOR-133248	insulin_receptor
MAPK1	PROTEIN	P28482	UNIPROT	JUN	PROTEIN	P05412	UNIPROT	Activates	Phosphorylation			9606;9606							23616010	YES		Erk also undergoes rapid translocation into the nucleus, where it phosphorylates and activates a variety of transcription factor targets, including sp1, e2f, elk-1, and ap1.	SIGNOR-38004	insulin_receptor
MAPK3	PROTEIN	P27361	UNIPROT	FOXO3	PROTEIN	O43524	UNIPROT	Inactivates	Phosphorylation	Ser344	QDDDAPLsPMLYSSS	9606;9606							19282669	YES		Phosphorylation of foxo3a by erk1/2 at residues ser 294, ser 344 and ser 425 increases foxo3amdm2 interaction and enhances foxo3a degradation via an mdm2-dependent ubiquitin-proteasome pathway	SIGNOR-21311	insulin_receptor
AKT2	PROTEIN	P31751	UNIPROT	TSC2	PROTEIN	P49815	UNIPROT	Inactivates	Phosphorylation	Ser939	SFRARSTsLNERPKS	9606;9606							12150915	YES		We demonstrate here that tuberin is phosphorylated on s939 and t1462 in response to pi3k activation. Our results are consistent with akt being the pi3k-depen-dent tuberin kinase. The pi3k-akt-mediated phosphorylation of tuberin would inhibit the function of the tuberin-hamartin complex.	SIGNOR-83439	insulin_receptor
PDPK1	PROTEIN	O15530	UNIPROT	PDPK1	PROTEIN	O15530	UNIPROT	Activates	Phosphorylation	Ser241	SKQARANsFVGTAQY	9606;9606							10455013	YES			SIGNOR-18495	insulin_receptor
MAPK3	PROTEIN	P27361	UNIPROT	RAF1	PROTEIN	P04049	UNIPROT	Activates	Phosphorylation	Ser296	SPSALSSsPNNLSPT	9606;9606							16407412	YES		Erk-1 expression sustains raf-1 activation in a manner dependent on raf-1 phosphorylation on the identified sites, and s289/296/301a substitution markedly decreases the in vivo activity of raf-1 s259a	SIGNOR-34179	insulin_receptor
INSR	PROTEIN	P06213	UNIPROT	IRS1	PROTEIN	P35568	UNIPROT	Activates	Phosphorylation	Tyr989	VPSSRGDyMTMQMSC	9606;9606							7651388	YES		Therefore, during Insulin stimulation IRS-1 undergoes tyrosine phosphorylation, and a portion of tyrosine phosphorylated IRS-1 associated with the Insulin receptor. The Insulin receptor substrate-1 (IRS-1) is rapidly phosphorylated on several tyrosine residues by the activated Insulin receptor. Insulin signals are mediated through tyrosine phosphorylation of specific proteins such as Insulin receptor substrate 1 (IRS-1) and Shc by the activated Insulin receptor (IR).	SIGNOR-71938	insulin_receptor
AKT1	PROTEIN	P31749	UNIPROT	MTOR	PROTEIN	P42345	UNIPROT	Activates	Phosphorylation	Ser2448	RSRTRTDsYSAGQSV	9606;9606							12782654	NO		It was shown recently that akt activates mtor through direct phosphorylation of tsc2. The serine/threonine kinase akt is an upstream positive regulator of the mammalian target of rapamycin (mtor). However, the mechanism by which akt activates mtor is not fully understood. The known pathway by which akt activates mtor is via direct phosphorylation and tuberous sclerosis complex 2 (tsc2), which is a negative regulator of mtor.	SIGNOR-77161	insulin_receptor
AKT1	PROTEIN	P31749	UNIPROT	SLC2A4	PROTEIN	P14672	UNIPROT	Activates	Relocalization			9606;9606		Translocation from intracellular compartment to cell surface in muscle and adipose tissue					8940145	NO		Akt is not only capable of stimulating the translocation of glut4 to the cell surface. Endogenous akt is likely to play a significant physiological role in insulin-stimulated glucose uptake in insulin targets such as muscle and adipose tissue	SIGNOR-49706	insulin_receptor
CHUK	PROTEIN	O15111	UNIPROT	NFKB1	PROTEIN	P19838	UNIPROT	Inactivates	Phosphorylation	Ser923	DELRDSDsVCDSGVE	9606;9606							11297557	YES		The i b kinase (ikk) complex rapidly phosphorylates nf- b1 p105 on serine 927 in the pest region romashkova et al. demonstrated that akt binds to and activates inhibitor of kappa b kinase-alfa (ikkalfa), which in turn phosphorylates and thereby promotes the degradation of the inhibitory cofactor of nf-kb, i-kb the scf-betatrcp complex is responsible for the ubiquitination of p100 and p105 following their phosphorylation by ikk.	SIGNOR-57129	insulin_receptor
PDPK1	PROTEIN	O15530	UNIPROT	AKT1	PROTEIN	P31749	UNIPROT	Activates	Phosphorylation	Thr308	KDGATMKtFCGTPEY	9606;9606							21798082	YES		Pip3 acts in turn as a docking site for two kinases, phosphoinositidedependent kinase 1 (pdk1) and akt, and the subsequent phosphorylation of akt at serine 308 by pdk1, leading to akt activation.	SIGNOR-67950	insulin_receptor
GSK3B	PROTEIN	P49841	UNIPROT	JUN	PROTEIN	P05412	UNIPROT	Inactivates	Phosphorylation			9606;9606							16023596	YES		The c-jun and c-myc oncogenic transcription factors are highly unstable proteins due to polyubiquitination. Similar to c-myc, we report here that phosphorylation of c-jun by gsk3 creates a high-affinity binding site for the e3 ligase fbw7, which targets c-jun for polyubiquitination and proteasomal degradation| similar to c-myc, we report here that phosphorylation of c-jun by gsk3 creates a high-affinity binding site for the e3 ligase fbw7, which targets c-jun for polyubiquitination and proteasomal degradation.	SIGNOR-38014	insulin_receptor
AKT1	PROTEIN	P31749	UNIPROT	FOXO1	PROTEIN	Q12778	UNIPROT	Inactivates	Phosphorylation	Ser256	SPRRRAAsMDNNSKF	9606;9606							21798082	YES		Akt negatively regulates the raf and gsk-3 kinases and the cell cycle regulatory transcription factor fkhr our results demonstrate that pkb/akt directly phosphorylates fkhr1, a member of the closely related fkhr subclass of the forkhead family of transcription factors, on at least two residues (threonine-24 and serine-253).These Results indicate that phosphorylation by pkbyakt negatively regulates fkhr1 by promoting export from the nucleus. Acting through the pi3k/akt pathway,insulinand insulin-like growth factor-1 (igf-1) inactivate foxo transcription factors, a class of highly conserved proteins important in numerous physiological functions	SIGNOR-98343	insulin_receptor
PDPK1	PROTEIN	O15530	UNIPROT	PDPK1	PROTEIN	O15530	UNIPROT	Activates	Phosphorylation	Ser241	SKQARANsFVGTAQY	9606;9606							14623982	YES			SIGNOR-18510	insulin_receptor
TSC1	PROTEIN	Q92574	UNIPROT	TSC2	PROTEIN	P49815	UNIPROT	Activates	Binding			9606;9606							15340059	YES		Analysis of tsc1 binding defective mutants of tsc2 shows that tsc1 is not required for the tsc2 gap activity but may function as a regulatory component in the tsc1/tsc2 complex.	SIGNOR-83400	insulin_receptor
PRKCZ	PROTEIN	Q05513	UNIPROT	PRKCZ	PROTEIN	Q05513	UNIPROT	Activates	Phosphorylation	Thr560	TSEPVQLtPDDEDAI	9606;9606							11141077	YES		Our findings suggest that insulin, via pip(3), provokes increases in pkc-zeta enzyme activity through (a) pdk-1-dependent t410 loop phosphorylation, (b) t560 autophosphorylation	SIGNOR-95435	insulin_receptor
MAP2K1	PROTEIN	Q02750	UNIPROT	MAPK3	PROTEIN	P27361	UNIPROT	Activates	Phosphorylation	Thr202	HDHTGFLtEYVATRW	9606;9606							9677429	YES	MAPK3/ERK1 is a MAPK which plays an important role in the MAPK/ERK cascade.	The MEK1 proline-rich insert is required for efficient activation of the mitogen-activated protein kinases ERK1 and ERK2 in mammalian cells.	SIGNOR-131413	insulin_receptor
TSC2	PROTEIN	P49815	UNIPROT	MTOR	PROTEIN	P42345	UNIPROT	Inactivates				9606;9606							12271141	NO		These findings strongly implicate the tuberin-hamartin tumor suppressor complex as an inhibitor of mtor	SIGNOR-76930	insulin_receptor
INSR	PROTEIN	P06213	UNIPROT	IRS1	PROTEIN	P35568	UNIPROT	Activates	Phosphorylation	Tyr1179	GLENGLNyIDLDLVK	9606;9606							7651388	YES		Therefore, during Insulin stimulation IRS-1 undergoes tyrosine phosphorylation, and a portion of tyrosine phosphorylated IRS-1 associated with the Insulin receptor. The Insulin receptor substrate-1 (IRS-1) is rapidly phosphorylated on several tyrosine residues by the activated Insulin receptor. Insulin signals are mediated through tyrosine phosphorylation of specific proteins such as Insulin receptor substrate 1 (IRS-1) and Shc by the activated Insulin receptor (IR).	SIGNOR-71640	insulin_receptor
PTPN1	PROTEIN	P18031	UNIPROT	INSR	PROTEIN	P06213	UNIPROT	Inactivates	Dephosphorylation	Tyr999	YASSNPEyLSASDVF	9606;9606							11579209	YES		Ptp1b is a protein tyrosine phosphatase that negatively regulates insulin sensitivity by dephosphorylating the insulin receptor.	SIGNOR-39544	insulin_receptor
MTOR	PROTEIN	P42345	UNIPROT	AKT1	PROTEIN	P31749	UNIPROT	Activates	Phosphorylation	Thr450	TAQMITItPPDQDDS	9606;9606							9512493	YES			SIGNOR-68236	insulin_receptor
MTOR	PROTEIN	P42345	UNIPROT	AKT1	PROTEIN	P31749	UNIPROT	Activates	Phosphorylation	Thr450	TAQMITItPPDQDDS	9606;9606							23543412	YES			SIGNOR-68224	insulin_receptor
CHUK	PROTEIN	O15111	UNIPROT	NFKB1	PROTEIN	P19838	UNIPROT	Inactivates	Phosphorylation	Ser923	DELRDSDsVCDSGVE	9606;9606							10469655	YES		All residues of p105 phosphorylated by ikka are c-terminal; the major phosphorylation region contains three serines (ser923; ser927;ser932) and two threonines (thr927 and thr391).	SIGNOR-57133	insulin_receptor
AKT1	PROTEIN	P31749	UNIPROT	TSC2	PROTEIN	P49815	UNIPROT	Inactivates	Phosphorylation	Ser939	SFRARSTsLNERPKS	9606;9606							12150915	YES		We have shown thataktregulates the tsc1-tsc2 complex by directly phosphorylating tsc2. Tsc2 is inactivated by akt-dependent phosphorylation, which destabilizes tsc2 and disrupts its interaction with tsc1. Tsc2 is inactivated by akt-dependent phosphorylation, which destabilizes tsc2 and disrupts its interaction with tsc1|akt has been shown to directly phosphorylate two sites on tsc2 (s939 and t1462 on the full-length human protein), which are conserved and phosphorylated in drosophila tsc2, and is likely to phosphorylate two or three additional sites (s981 and s1130/s1132).	SIGNOR-83435	insulin_receptor
MTOR	PROTEIN	P42345	UNIPROT	AKT1	PROTEIN	P31749	UNIPROT	Activates	Phosphorylation	Thr450	TAQMITItPPDQDDS	9606;9606							9736715	YES			SIGNOR-68228	insulin_receptor
SOCS3	PROTEIN	O14543	UNIPROT	IRS1	PROTEIN	P35568	UNIPROT	Inactivates	Binding			9606;9606							23115649	NO		Irs-1 is the major signaling protein that socs3 targets to inhibit insulin signaling	SIGNOR-71506	insulin_receptor
INSR	PROTEIN	P06213	UNIPROT	INSR	PROTEIN	P06213	UNIPROT	Inactivates	Phosphorylation	Tyr1011	DVFPCSVyVPDEWEV	9606;9606							8024702	YES		Activation of the insulin receptor kinase is closely associated with autophosphorylation of several tyrosine residues in the cytoplasmic domain of the receptor's two beta-subunits.	SIGNOR-39338	insulin_receptor
PDPK1	PROTEIN	O15530	UNIPROT	AKT1	PROTEIN	P31749	UNIPROT	Activates	Phosphorylation	Thr308		9606;9606							21798082	YES		PIP3 acts in turn as a docking site for two kinases, phosphoinositidedependent kinase 1 (PDK1) and Akt, and the subsequent phosphorylation of Akt at serine 308 by PDK1, leading to Akt activation.	SIGNOR-131234	insulin_receptor
AKT2	PROTEIN	P31751	UNIPROT	PTPN1	PROTEIN	P18031	UNIPROT	Inactivates	Phosphorylation	Ser50	RNRYRDVsPFDHSRI	9606;9606							11579209	YES		We conclude that ptp1b is a novel substrate for akt and that phosphorylation of ptp1b by akt at ser(50) may negatively modulate its phosphatase activity creating a positive feedback mechanism forinsulinsignaling	SIGNOR-55191	insulin_receptor
RHEB	PROTEIN	Q15382	UNIPROT	MTOR	PROTEIN	P42345	UNIPROT	Activates	Binding			9606;9606							15854902	YES		Rheb stimulates the phosphorylation of mtor and plays an essential role in regulation of s6k and 4ebp1 in response to nutrients and cellular energy status.	SIGNOR-77064	insulin_receptor
INSR	PROTEIN	P06213	UNIPROT	INSR	PROTEIN	P06213	UNIPROT	Activates	Phosphorylation	Tyr1185	FGMTRDIyETDYYRK	9606;9606							11282018	YES		Insulin binding to its receptor results in receptor autophosphorylation on tyrosine residues and the tyrosine phosphorylation of insulin receptor substrates (irs-1, irs-2 and irs-3) by the insulin receptor tyrosine kinase.	SIGNOR-39347	insulin_receptor
AKT2	PROTEIN	P31751	UNIPROT	FOXO3	PROTEIN	O43524	UNIPROT	Inactivates	Phosphorylation	Ser315	DFRSRTNsNASTVSG	9606;9606							19188143	YES		Akt-dependent phosphorylation of foxo3a (thr32, ser253, and ser315 for human foxo3) enhances foxo3a/14?3?3 Interaction and promotes foxo3a nuclear export to the cytoplasm, resulting in the repression of foxo3a transcriptional function akt phosphorylates members of the foxo factors (forkhead family of transcription factors), leading to binding of 14-3-3 proteins and cytoplasmic localisation. In particular, akt phosphorylates foxo1 on thr24, ser256 and ser319. Foxo 3alfa and foxo4 are phosphorylated on equivalent sites.	SIGNOR-21289	insulin_receptor
PTEN	PROTEIN	P60484	UNIPROT	PIK3CB	PROTEIN	P42338	UNIPROT	Inactivates				9606;9606							18794881	NO		The pten tumour suppressor is a lipid and protein phosphatase that inhibits phosphoinositide 3-kinase (pi3k)-dependent by dephosphorylating phosphatidylinositol 3,4,5-trisphosphate (ptdinsp(3)).	SIGNOR-76654	insulin_receptor
MAPK3	PROTEIN	P27361	UNIPROT	TSC2	PROTEIN	P49815	UNIPROT	Inactivates	Phosphorylation			9606;9606							19188143	YES		Phosphorylation of tsc2 (by akt and erk; refs. 28, 29) and tsc1(by ikkbeta; ref. 30) results in the disruption of the tsc1/2 complex, and thereby activates the oncogenic mtor signaling contributing to tumor progression	SIGNOR-83383	insulin_receptor
AKT1	PROTEIN	P31749	UNIPROT	RAF1	PROTEIN	P04049	UNIPROT	Inactivates	Phosphorylation	Ser259	SQRQRSTsTPNVHMV	9606;9606							16854453	YES		Akt and protein kinase a (pka) phosphorylate s259 on raf-1 and inhibit its activity.	SIGNOR-34192	insulin_receptor
MAPK3	PROTEIN	P27361	UNIPROT	FOXO3	PROTEIN	O43524	UNIPROT	Inactivates	Phosphorylation	Ser294	QLSKWPGsPTSRSSD	9606;9606							19282669	YES		Phosphorylation of foxo3a by erk1/2 at residues ser 294, ser 344 and ser 425 increases foxo3amdm2 interaction and enhances foxo3a degradation via an mdm2-dependent ubiquitin-proteasome pathway	SIGNOR-21320	insulin_receptor
AKT1	PROTEIN	P31749	UNIPROT	RAF1	PROTEIN	P04049	UNIPROT	Inactivates	Phosphorylation			9606;9606							14967450	YES		Akt negatively regulates the raf and gsk-3 kinases and the cell cycle regulatory transcription factor fkhr.	SIGNOR-33902	insulin_receptor
CHUK	PROTEIN	O15111	UNIPROT	NFKB1	PROTEIN	P19838	UNIPROT	Inactivates	Phosphorylation	Ser932	CDSGVETsFRKLSFT	9606;9606							10469655	YES		All residues of p105 phosphorylated by ikka are c-terminal; the major phosphorylation region contains three serines (ser923; ser927;ser932) and two threonines (thr927 and thr391).	SIGNOR-57054	insulin_receptor
AKT1	PROTEIN	P31749	UNIPROT	FOXO4	PROTEIN	P98177	UNIPROT	Inactivates	Phosphorylation			9606;9606							21620960	YES		Akt phosphorylates members of the foxo factors (forkhead family of transcription factors), leading to binding of 14-3-3 proteins and cytoplasmic localisation. In particular, akt phosphorylates foxo1 on thr24, ser256 and ser319. Foxo 3alfa and foxo4 are phosphorylated on equivalent sites.  In addition, phosphorylation of afx by protein kinase b inhibits its transcriptional activity.	SIGNOR-91972	insulin_receptor
MTOR	PROTEIN	P42345	UNIPROT	AKT1	PROTEIN	P31749	UNIPROT	Activates	Phosphorylation	Ser473	RPHFPQFsYSASGTA	9606;9606							8978681	YES			SIGNOR-68054	insulin_receptor
INSR	PROTEIN	P06213	UNIPROT	IRS1	PROTEIN	P35568	UNIPROT	Activates	Phosphorylation	Tyr612	TLHTDDGyMPMSPGV	9606;9606							7651388	YES		Therefore, during Insulin stimulation IRS-1 undergoes tyrosine phosphorylation, and a portion of tyrosine phosphorylated IRS-1 associated with the Insulin receptor. The Insulin receptor substrate-1 (IRS-1) is rapidly phosphorylated on several tyrosine residues by the activated Insulin receptor. Insulin signals are mediated through tyrosine phosphorylation of specific proteins such as Insulin receptor substrate 1 (IRS-1) and Shc by the activated Insulin receptor (IR).	SIGNOR-71849	insulin_receptor
INSR	PROTEIN	P06213	UNIPROT	INSR	PROTEIN	P06213	UNIPROT	Activates	Phosphorylation	Tyr999	YASSNPEyLSASDVF	9606;9606							11282018	YES		Insulin binding to its receptor results in receptor autophosphorylation on tyrosine residues and the tyrosine phosphorylation of insulin receptor substrates (irs-1, irs-2 and irs-3) by the insulin receptor tyrosine kinase.	SIGNOR-39516	insulin_receptor
MAPK3	PROTEIN	P27361	UNIPROT	FOXO3	PROTEIN	O43524	UNIPROT	Inactivates	Phosphorylation	Ser425	TKGSGLGsPTSSFNS	9606;9606							19282669	YES		Phosphorylation of foxo3a by erk1/2 at residues ser 294, ser 344 and ser 425 increases foxo3amdm2 interaction and enhances foxo3a degradation via an mdm2-dependent ubiquitin-proteasome pathway	SIGNOR-21479	insulin_receptor
INS	PROTEIN	P01308	UNIPROT	GSK3B	PROTEIN	P49841	UNIPROT	Inactivates	Phosphorylation	Ser9	SGRPRTTsFAESCKP	9606;9606							8250835	NO		The results suggest that ser-9 phosphorylation underlies the reported gsk3 beta inhibition by insulin and that gsk3 may represent a point of convergence of two major growth-factor-stimulated protein kinase cascades.	SIGNOR-83719	insulin_receptor
TNF	PROTEIN	P01375	UNIPROT	IRS1	PROTEIN	P35568	UNIPROT	Inactivates				9606;9606							11287630	NO		Irs-1 tyrosine phosphorylation by tnf was blocked by rapamycin, an inhibitor of the mammalian target of rapamycin (mtor), a downstream target of akt. these results suggest that tnf impairs insulin signaling through irs-1	SIGNOR-71509	insulin_receptor
CHUK	PROTEIN	O15111	UNIPROT	NFKB1	PROTEIN	P19838	UNIPROT	Inactivates	Phosphorylation	Ser932	CDSGVETsFRKLSFT	9606;9606							11297557	YES		The i b kinase (ikk) complex rapidly phosphorylates nf- b1 p105 on serine 927 in the pest region romashkova et al. demonstrated that akt binds to and activates inhibitor of kappa b kinase-alfa (ikkalfa), which in turn phosphorylates and thereby promotes the degradation of the inhibitory cofactor of nf-kb, i-kb the scf-betatrcp complex is responsible for the ubiquitination of p100 and p105 following their phosphorylation by ikk.	SIGNOR-57050	insulin_receptor
AKT1	PROTEIN	P31749	UNIPROT	MTOR	PROTEIN	P42345	UNIPROT	Activates				9606;9606							21798082	YES		Akt Inactivates protein degradation by phosphorylating and thus repressing the transcription factors of the FoxO family, and stimulates protein synthesis via the mammalian target of rapamycin (mTOR) and glycogen synthase kinase 3b (GSK3b).	SIGNOR-131253	insulin_receptor
AKT2	PROTEIN	P31751	UNIPROT	FOXO3	PROTEIN	O43524	UNIPROT	Inactivates	Phosphorylation	Thr32	QSRPRSCtWPLQRPE	9606;9606							19188143	YES		Akt-dependent phosphorylation of foxo3a (thr32, ser253, and ser315 for human foxo3) enhances foxo3a/14?3?3 Interaction and promotes foxo3a nuclear export to the cytoplasm, resulting in the repression of foxo3a transcriptional function akt phosphorylates members of the foxo factors (forkhead family of transcription factors), leading to binding of 14-3-3 proteins and cytoplasmic localisation. In particular, akt phosphorylates foxo1 on thr24, ser256 and ser319. Foxo 3alfa and foxo4 are phosphorylated on equivalent sites.	SIGNOR-21382	insulin_receptor
PDPK1	PROTEIN	O15530	UNIPROT	AKT2	PROTEIN	P31751	UNIPROT	Activates	Phosphorylation	Thr309	SDGATMKtFCGTPEY	9606;9606							15743829	YES		Akt1 and akt2 are phosphorylated and activated by the protein kinase pdk1 at thr-308 or thr-309, respectively, in the activation t-loop, and further activation occurs through phosphorylation at ser-473 or ser-474, respectively. Pdk1 phosphorylates akt-2 at thr 309 in the catalytic domain, leading to enzymatic activation.	SIGNOR-68362	insulin_receptor
MTOR	PROTEIN	P42345	UNIPROT	IRS1	PROTEIN	P35568	UNIPROT	Inactivates	Phosphorylation	Ser315	ITATSPAsMVGGKPG	9606;9606							11287630	NO		Mtor induced the serine phosphorylation of irs-1 (ser-636/639), and such phosphorylation was inhibited by rapamycin. These results suggest that tnf impairsinsulinsignaling through irs-1 by activation of a pi 3-kinase/akt/mtor pathway, which is antagonized by pten	SIGNOR-71705	insulin_receptor
AKT1	PROTEIN	P31749	UNIPROT	FOXO3	PROTEIN	O43524	UNIPROT	Inactivates	Phosphorylation	Ser315	DFRSRTNsNASTVSG	9606;9606							19188143	YES		Akt-dependent phosphorylation of foxo3a (thr32, ser253, and ser315 for human foxo3) enhances foxo3a/14?3?3 Interaction and promotes foxo3a nuclear export to the cytoplasm, resulting in the repression of foxo3a transcriptional function	SIGNOR-21285	insulin_receptor
AKT1	PROTEIN	P31749	UNIPROT	MTOR	PROTEIN	P42345	UNIPROT	Activates				9606;9606							16027121	NO		The serine/threonine kinase akt is an upstream positive regulator of the mammalian target of rapamycin (mtor). However, the mechanism by which akt activates mtor is not fully understood. The known pathway by which akt activates mtor is via direct phosphorylation and tuberous sclerosis complex 2 (tsc2), which is a negative regulator of mtor. It was shown recently that akt activates mtor through direct phosphorylation of tsc2.	SIGNOR-76841	insulin_receptor
INSR	PROTEIN	P06213	UNIPROT	IRS1	PROTEIN	P35568	UNIPROT	Activates	Phosphorylation	Tyr1229	SSEDLSAyASISFQK	9606;9606							7651388	YES		Therefore, during Insulin stimulation IRS-1 undergoes tyrosine phosphorylation, and a portion of tyrosine phosphorylated IRS-1 associated with the Insulin receptor. The Insulin receptor substrate-1 (IRS-1) is rapidly phosphorylated on several tyrosine residues by the activated Insulin receptor. Insulin signals are mediated through tyrosine phosphorylation of specific proteins such as Insulin receptor substrate 1 (IRS-1) and Shc by the activated Insulin receptor (IR).	SIGNOR-71815	insulin_receptor
FAS	PROTEIN	P25445	UNIPROT	FAS	PROTEIN	P25445	UNIPROT	Activates	Binding			9606;9606							14585075	YES		The Fas Receptor, upon binding to the FasL, trimerizes	SIGNOR-132559	insulin_receptor
AKT2	PROTEIN	P31751	UNIPROT	TSC2	PROTEIN	P49815	UNIPROT	Inactivates	Phosphorylation	Ser939	SFRARSTsLNERPKS	9606;9606							19188143	YES		We demonstrate here that tuberin is phosphorylated on s939 and t1462 in response to pi3k activation. Our results are consistent with akt being the pi3k-depen-dent tuberin kinase. The pi3k-akt-mediated phosphorylation of tuberin would inhibit the function of the tuberin-hamartin complex.	SIGNOR-83443	insulin_receptor
TSC2	PROTEIN	P49815	UNIPROT	RHEB	PROTEIN	Q15382	UNIPROT	Inactivates	Gtpase-activating protein			9606;9606							15340059	YES		Tsc2 functions as a gap to inhibit rheb activity. Tsc2 displays gap (gtpase-activating protein) activity specifically towards the small g protein rheb and inhibits its ability to stimulate the mtor signaling pathway. It has recently been shown that tsc2 has gtpase-activating protein (gap) activity towards the ras family small gtpase rheb (ras homolog enriched in brain), and tsc1/2 antagonizes the mtor signaling pathway via stimulation of gtp hydrolysis of rheb.	SIGNOR-105128	insulin_receptor
MAPK1	PROTEIN	P28482	UNIPROT	SLC2A4	PROTEIN	P14672	UNIPROT	Activates	Relocalization			9606;9606							20231899	NO		An erk pharmacological inhibitor, pd98059, and the pld inhibitor, 1-btoh, both attenuate (14)c-glucose uptake in muscle cells. Finally, the extracellular stresses caused by glucose deprivation or aminoimidazole carboxamide ribonucleotide (aicar; ampk activator) regulate (14)c-glucose uptake and cell surface glucose transport (glut) 4 through erk stimulation by ampk-mediated pld1 activation.	SIGNOR-49700	insulin_receptor
MTOR	PROTEIN	P42345	UNIPROT	IRS1	PROTEIN	P35568	UNIPROT	Inactivates	Phosphorylation	Ser307	TRRSRTEsITATSPA	9606;9606							14579029	NO		Mtor induced the serine phosphorylation of irs-1 (ser-636/639), and such phosphorylation was inhibited by rapamycin. These results suggest that tnf impairsinsulinsignaling through irs-1 by activation of a pi 3-kinase/akt/mtor pathway, which is antagonized by pten	SIGNOR-71906	insulin_receptor
AKT1	PROTEIN	P31749	UNIPROT	MTOR	PROTEIN	P42345	UNIPROT	Activates	Phosphorylation	Ser2448	RSRTRTDsYSAGQSV	9606;9606							10910062	YES		Akt phosphorylates mtor directly. Akt may also work indirectly on mtor through the actions of the tsc1/tsc2 (tuberous sclerosis complex).	SIGNOR-77149	insulin_receptor
CHUK	PROTEIN	O15111	UNIPROT	NFKB1	PROTEIN	P19838	UNIPROT	Inactivates	Phosphorylation	Thr931	VCDSGVEtSFRKLSF	9606;9606							10469655	YES		All residues of p105 phosphorylated by ikka are c-terminal; the major phosphorylation region contains three serines (ser923; ser927;ser932) and two threonines (thr927 and thr391).	SIGNOR-57153	insulin_receptor
