EIF4EBP1	PROTEIN	Q13541	UNIPROT	EIF4E	PROTEIN	P06730	UNIPROT	Inactivates	Binding			9606;9606							20670887	YES		The newly discovered eif4e-binding proteins described below interact with the eif4e on only specific mrnas.	SIGNOR-40439	mtor_signaling
AKT1S1	PROTEIN	Q96B36	UNIPROT	MTOR	PROTEIN	P42345	UNIPROT	Inactivates	Binding			9606;9606							17277771	YES		Binding of pras40 inhibits mtor activity we identify pras40 as a raptor-interacting protein that binds to mtorc1 in insulin-deprived cells and whose in vitro interaction with mtorc1 is disrupted by high salt concentrations overexpression of a pras40t246a mutant can block akt activation of s6k1, suggesting that akt-mediated phoshorylation of pras40 at t246 stimulates mtorc1 signaling.	SIGNOR-77122	mtor_signaling
SREBF1	PROTEIN	P36956	UNIPROT	PPARG	PROTEIN	P37231	UNIPROT	Activates				9606;9606							21157483	NO		Active srebp-1c enhances ppar-gamma activity and transactivates a set of genes directly involved in lipid synthesis.	SIGNOR-74158	mtor_signaling
MTOR	PROTEIN	P42345	UNIPROT	MTOR	PROTEIN	P42345	UNIPROT	Activates	Phosphorylation	Ser2481	TVPESIHsFIGDGLV	9606;9606							10702316	YES		Mtorc1- and likely mtorc2-associated mtor ser-2481 autophosphorylation directly monitors intrinsic mtorc-specific catalytic activity and reveal that rapamycin inhibits mtorc1 signaling in vivo by reducing mtorc1 catalytic activity.	SIGNOR-77166	mtor_signaling
MAPK1	PROTEIN	P28482	UNIPROT	TSC1	PROTEIN	Q92574	UNIPROT	Inactivates	Phosphorylation			9606;9606							17671177	YES		Here, we show that erk may play a critical role in tsc progression through posttranslational inactivation of tsc2. Erk-dependent phosphorylation leads to tsc1-tsc2 dissociation and markedly impairs tsc2 ability to inhibit mtor signalin.	SIGNOR-113829	mtor_signaling
MAPK1	PROTEIN	P28482	UNIPROT	IRS1	PROTEIN	P35568	UNIPROT	Inactivates	Phosphorylation	Ser312	TESITATsPASMVGG	9606;9606							17242212	NO		Our data suggest that il-6 impairs the vasodilator effects of insulin that are mediated by the irs-1/pi3-kinase/akt/enos pathway through activation of jnk and erk1/2.	SIGNOR-71836	mtor_signaling
MAPK1	PROTEIN	P28482	UNIPROT	PPARG	PROTEIN	P37231	UNIPROT	Inactivates	Phosphorylation	Ser112	AIKVEPAsPPYYSEK	9606;9606							9099735	YES		Moreover, the inhibition of erks 1 and 2 with a mek inhibitor, u1026, lead to an inhibition in the decay of ppargamma proteins, indicating that serine phosphorylation influences the degradation of ppargamma in fat cells.	SIGNOR-74183	mtor_signaling
PTEN	PROTEIN	P60484	UNIPROT	AKT1	PROTEIN	P31749	UNIPROT	Inactivates	Dephosphorylation			9606;9606							19903340	NO		Exposure of eol-1r cells to imatinib failed to dephosphorylate akt, erk and stat5, although pdgfralpha was effectively inactivated. The forced expression of pten negatively regulated these signal pathways and sensitized eol-1r cells to imatinib.	SIGNOR-67816	mtor_signaling
INSR	PROTEIN	P06213	UNIPROT	IRS1	PROTEIN	P35568	UNIPROT	Activates	Phosphorylation	Tyr941	EETGTEEyMKMDLGP	9606;9606							7651388	YES		Therefore, during Insulin stimulation IRS-1 undergoes tyrosine phosphorylation, and a portion of tyrosine phosphorylated IRS-1 associated with the Insulin receptor. The Insulin receptor substrate-1 (IRS-1) is rapidly phosphorylated on several tyrosine residues by the activated Insulin receptor. Insulin signals are mediated through tyrosine phosphorylation of specific proteins such as Insulin receptor substrate 1 (IRS-1) and Shc by the activated Insulin receptor (IR).	SIGNOR-71567	mtor_signaling
AKT1	PROTEIN	P31749	UNIPROT	MTOR	PROTEIN	P42345	UNIPROT	Activates	Phosphorylation	Ser2448	RSRTRTDsYSAGQSV	9606;9606							19079619	YES		Akt phosphorylates mtor directly. Akt may also work indirectly on mtor through the actions of the tsc1/tsc2 (tuberous sclerosis complex).	SIGNOR-77153	mtor_signaling
TSC2	PROTEIN	P49815	UNIPROT	RHEB	PROTEIN	Q15382	UNIPROT	Inactivates	Gtpase-activating protein			9606;9606							14729330	YES		Tsc2 functions as a gap to inhibit rheb activity. Tsc2 displays gap (gtpase-activating protein) activity specifically towards the small g protein rheb and inhibits its ability to stimulate the mtor signaling pathway. It has recently been shown that tsc2 has gtpase-activating protein (gap) activity towards the ras family small gtpase rheb (ras homolog enriched in brain), and tsc1/2 antagonizes the mtor signaling pathway via stimulation of gtp hydrolysis of rheb.	SIGNOR-105135	mtor_signaling
AKT1	PROTEIN	P31749	UNIPROT	GSK3B	PROTEIN	P49841	UNIPROT	Inactivates	Phosphorylation	Ser9	SGRPRTTsFAESCKP	9606;9606							11279265	YES		Activated pkb induces gsk-3 inhibition via the phosphorylation of ser9 in gsk-3b	SIGNOR-83724	mtor_signaling
MAPK1	PROTEIN	P28482	UNIPROT	GSK3B	PROTEIN	P49841	UNIPROT	Activates				9606;9606							18045539	YES			SIGNOR-83602	mtor_signaling
AKT1	PROTEIN	P31749	UNIPROT	MTOR	PROTEIN	P42345	UNIPROT	Activates	Phosphorylation	Ser2448	RSRTRTDsYSAGQSV	9606;9606							12807916	YES		Akt phosphorylates mtor directly. Akt may also work indirectly on mtor through the actions of the tsc1/tsc2 (tuberous sclerosis complex).	SIGNOR-77157	mtor_signaling
GSK3B	PROTEIN	P49841	UNIPROT	SREBF1	PROTEIN	P36956	UNIPROT	Inactivates	Phosphorylation	Ser434	PPPSDAGsPFQSSPL	9606;9606							21723501	YES		Gsk-3-mediated phosphorylation of thr-426 and ser-430 in the c terminus of mature srebp1 creates a docking site for fbw7 (also known as human cdc4), the substrate recognition component of a specific scf ubiquitin ligase	SIGNOR-73884	mtor_signaling
PIK3CA	PROTEIN	P42336	UNIPROT	IRS1	PROTEIN	P35568	UNIPROT	Inactivates	Phosphorylation	Ser307	TRRSRTEsITATSPA	9606;9606							11160134	YES		Thus, at least three kinases mediate phosphorylation of ser307, including jnk, serine kinases in the pi 3-kinase cascade that are activated byinsulinor igf-1, and mek1-sensitive kinase cascades during tnf-alfa stimulation.	SIGNOR-71885	mtor_signaling
MAPK1	PROTEIN	P28482	UNIPROT	TSC1	PROTEIN	Q92574	UNIPROT	Inactivates	Phosphorylation			9606;9606							15851026	YES		Here, we show that erk may play a critical role in tsc progression through posttranslational inactivation of tsc2. Erk-dependent phosphorylation leads to tsc1-tsc2 dissociation and markedly impairs tsc2 ability to inhibit mtor signalin.	SIGNOR-113825	mtor_signaling
MAPK3	PROTEIN	P27361	UNIPROT	RPTOR	PROTEIN	Q8N122	UNIPROT	Activates	Phosphorylation	Ser863	LTQSAPAsPTNKGVH	9606;9606							21757713	YES		Activation; protein conformation; phosphorylation;required for rheb-stimulated phosphorylation of s855 and s859;  necessary for phosphorylation of s859; mtorc1 activation; activates mtor towards p70s6k1 in response to insulin.	SIGNOR-112161	mtor_signaling
MTOR	PROTEIN	P42345	UNIPROT	RPTOR	PROTEIN	Q8N122	UNIPROT	Activates	Phosphorylation	Ser859	DTSSLTQsAPASPTN	9606;9606							19864431	YES		Ser863and ser859in raptor were phosphorylated by mtor bothin vivoandin vitro.	SIGNOR-112097	mtor_signaling
INSR	PROTEIN	P06213	UNIPROT	INSR	PROTEIN	P06213	UNIPROT	Activates	Phosphorylation	Tyr1190	DIYETDYyRKGGKGL	9606;9606							11282018	YES		Insulin binding to its receptor results in receptor autophosphorylation on tyrosine residues and the tyrosine phosphorylation of insulin receptor substrates (irs-1, irs-2 and irs-3) by the insulin receptor tyrosine kinase.	SIGNOR-39104	mtor_signaling
MTOR	PROTEIN	P42345	UNIPROT	ULK1	PROTEIN	O75385	UNIPROT	Activates	Phosphorylation	Ser758	PVVFTVGsPPSGSTP	9606;9606							21383122	YES		When cells are replenished with rich medium, mTOR is activated; it phosphorylates serine 638 and serine 758. The phosphorylation of Ulk1 at serine 758 then leads to reassociation between Ulk1 and AMPK	SIGNOR-128282	mtor_signaling
MAPK3	PROTEIN	P27361	UNIPROT	RPTOR	PROTEIN	Q8N122	UNIPROT	Activates	Phosphorylation	Ser863	LTQSAPAsPTNKGVH	9606;9606							19864431	YES		Activation; protein conformation; phosphorylation;required for rheb-stimulated phosphorylation of s855 and s859;  necessary for phosphorylation of s859; mtorc1 activation; activates mtor towards p70s6k1 in response to insulin.	SIGNOR-112165	mtor_signaling
TSC2	PROTEIN	P49815	UNIPROT	RHEB	PROTEIN	Q15382	UNIPROT	Inactivates	Gtpase-activating protein			9606;9606							12869586	YES		Tsc2 functions as a gap to inhibit rheb activity. Tsc2 displays gap (gtpase-activating protein) activity specifically towards the small g protein rheb and inhibits its ability to stimulate the mtor signaling pathway. It has recently been shown that tsc2 has gtpase-activating protein (gap) activity towards the ras family small gtpase rheb (ras homolog enriched in brain), and tsc1/2 antagonizes the mtor signaling pathway via stimulation of gtp hydrolysis of rheb.	SIGNOR-105131	mtor_signaling
STK11	PROTEIN	Q15831	UNIPROT	STK11	PROTEIN	Q15831	UNIPROT	Activates	Phosphorylation	Thr363	IEDDIIYtQDFTVPG	9606;9606							12805220	YES			SIGNOR-106406	mtor_signaling
AKT1S1	PROTEIN	Q96B36	UNIPROT	MTOR	PROTEIN	P42345	UNIPROT	Inactivates	Binding			9606;9606							14607085	YES		Binding of pras40 inhibits mtor activity we identify pras40 as a raptor-interacting protein that binds to mtorc1 in insulin-deprived cells and whose in vitro interaction with mtorc1 is disrupted by high salt concentrations overexpression of a pras40t246a mutant can block akt activation of s6k1, suggesting that akt-mediated phoshorylation of pras40 at t246 stimulates mtorc1 signaling.	SIGNOR-77118	mtor_signaling
AKT2	PROTEIN	P31751	UNIPROT	TSC2	PROTEIN	P49815	UNIPROT	Inactivates	Phosphorylation	Thr1462	GLRPRGYtISDSAPS	9606;9606							12172553	YES		We demonstrate here that tuberin is phosphorylated on s939 and t1462 in response to pi3k activation. Our results are consistent with akt being the pi3k-depen-dent tuberin kinase. The pi3k-akt-mediated phosphorylation of tuberin would inhibit the function of the tuberin-hamartin complex.	SIGNOR-83418	mtor_signaling
AKT2	PROTEIN	P31751	UNIPROT	GSK3B	PROTEIN	P49841	UNIPROT	Inactivates	Phosphorylation			9606;9606							16293724	YES		Activated pi3k/akt pathway results in inhibitory phos-phorylation of gsk3. another predicted action of pi3k and akt activation is to inhibit gsk-3 through phosphorylation. we show that pge2 stimulates colon cancer cell growth through its heterotrimeric guanine nucleotide-binding protein (g protein)coupled receptor, ep2, by a signaling route that involves the activation of phosphoinositide 3-kinase and the protein kinase akt by free g protein bg subunits and the direct association of the g protein as subunit with the regulator of g protein signaling (rgs) domain of axin. This leads to the inactivation and release of glycogen synthase kinase 3b from its complex with axin, thereby relieving the inhibitory phosphorylation of b-catenin and activating its signaling pathway.	SIGNOR-83611	mtor_signaling
INSR	PROTEIN	P06213	UNIPROT	IRS1	PROTEIN	P35568	UNIPROT	Activates	Phosphorylation	Tyr632	GRKGSGDyMPMSPKS	9606;9606							7651388	YES		Therefore, during Insulin stimulation IRS-1 undergoes tyrosine phosphorylation, and a portion of tyrosine phosphorylated IRS-1 associated with the Insulin receptor. The Insulin receptor substrate-1 (IRS-1) is rapidly phosphorylated on several tyrosine residues by the activated Insulin receptor. Insulin signals are mediated through tyrosine phosphorylation of specific proteins such as Insulin receptor substrate 1 (IRS-1) and Shc by the activated Insulin receptor (IR).	SIGNOR-71668	mtor_signaling
TSC2	PROTEIN	P49815	UNIPROT	TSC1	PROTEIN	Q92574	UNIPROT	Activates	Binding			9606;9606							10807585	YES		Furthermore, tsc2 is directly phosphorylated by akt, which is involved in stimulating cell growth and is activated by growth stimulating signals, such as insulin. Tsc2 is inactivated by akt-dependent phosphorylation, which destabilizes tsc2 and disrupts its interaction with tsc1.	SIGNOR-113833	mtor_signaling
PIK3CA	PROTEIN	P42336	UNIPROT	AKT1	PROTEIN	P31749	UNIPROT	Activates	Phosphorylation	Ser473	RPHFPQFsYSASGTA	9606;9606							12167717	YES		Akt may be regulated by both phosphorylation and by the direct binding of pi3k to the akt pleckstrin homology (ph) domain. Pi3k activity was equally important for promoting phosphorylation of serine 473, but this was separable from membrane localization however, this study shows that akt signaling is markedly diminished in many cancer cell lines and human breast tumors harboring pik3ca mutations.	SIGNOR-68030	mtor_signaling
MAPK1	PROTEIN	P28482	UNIPROT	RPS6KB1	PROTEIN	P23443	UNIPROT	Activates	Phosphorylation	Ser447	GSPRTPVsPVKFSPG	9606;9606							7545671	YES		Erk phosphorylates multiple cytoplasmatic and cytoskeletal proteins, including mapk-activated protein kinases and the ribosomal p70-s6 kinase	SIGNOR-59869	mtor_signaling
MTOR	PROTEIN	P42345	UNIPROT	EIF4EBP1	PROTEIN	Q13541	UNIPROT	Inactivates	Phosphorylation	Thr70	RNSPVTKtPPRDLPT	9606;9606							10942774	YES		Mammalian target of rapamycin-dependent phosphorylation of PHAS-I in four (S/T)P sites detected by phospho-specific antibodies.	SIGNOR-101788	mtor_signaling
MTOR	PROTEIN	P42345	UNIPROT	MTOR	PROTEIN	P42345	UNIPROT	Activates	Phosphorylation	Ser2481	TVPESIHsFIGDGLV	9606;9606							12807916	YES		Mtorc1- and likely mtorc2-associated mtor ser-2481 autophosphorylation directly monitors intrinsic mtorc-specific catalytic activity and reveal that rapamycin inhibits mtorc1 signaling in vivo by reducing mtorc1 catalytic activity.	SIGNOR-77175	mtor_signaling
AKT1	PROTEIN	P31749	UNIPROT	MTOR	PROTEIN	P42345	UNIPROT	Activates				9606;9606							12782654	NO		The serine/threonine kinase akt is an upstream positive regulator of the mammalian target of rapamycin (mtor). However, the mechanism by which akt activates mtor is not fully understood. The known pathway by which akt activates mtor is via direct phosphorylation and tuberous sclerosis complex 2 (tsc2), which is a negative regulator of mtor. It was shown recently that akt activates mtor through direct phosphorylation of tsc2.	SIGNOR-76844	mtor_signaling
TSC1	PROTEIN	Q92574	UNIPROT	MTOR	PROTEIN	P42345	UNIPROT	Inactivates				9606;9606							12271141	NO		These findings strongly implicate the tuberin-hamartin tumor suppressor complex as an inhibitor of mtor. Here, we show that hamartin and tuberin function together to inhibit mammalian target of rapamycin (mtor)-mediated signaling to eukaryotic initiation factor 4e-binding protein 1 (4e-bp1) and ribosomal protein s6 kinase 1 (s6k1).	SIGNOR-77114	mtor_signaling
MTOR	PROTEIN	P42345	UNIPROT	RPS6KB1	PROTEIN	P23443	UNIPROT	Activates	Phosphorylation	Ser434	SFEPKIRsPRRFIGS	9606;9606							12782654	YES		These results indicate that arg, leu, and gln act coordinately to stimulate proliferation of ptr cells through activation of the mtor-rps6k-rps6-eif4ebp1 signal transduction pathway.	SIGNOR-60027	mtor_signaling
MTOR	PROTEIN	P42345	UNIPROT	IRS1	PROTEIN	P35568	UNIPROT	Inactivates	Phosphorylation	Ser639	YMPMSPKsVSAPQQI	9606;9606							11287630	NO		Mtor induced the serine phosphorylation of irs-1 (ser-636/639), and such phosphorylation was inhibited by rapamycin. These results suggest that tnf impairsinsulinsignaling through irs-1 by activation of a pi 3-kinase/akt/mtor pathway, which is antagonized by pten	SIGNOR-71962	mtor_signaling
MTOR	PROTEIN	P42345	UNIPROT	RPTOR	PROTEIN	Q8N122	UNIPROT	Activates	Phosphorylation	Ser863	LTQSAPAsPTNKGVH	9606;9606							21757713	YES		Ser863and ser859in raptor were phosphorylated by mtor bothin vivoandin vitro.	SIGNOR-112185	mtor_signaling
GSK3B	PROTEIN	P49841	UNIPROT	GSK3B	PROTEIN	P49841	UNIPROT	Activates	Phosphorylation	Tyr216	RGEPNVSyICSRYYR	9606;9606							18701488	YES		GSK3B is activated by phosphorylation at Tyr-279.	SIGNOR-83715	mtor_signaling
MAPK3	PROTEIN	P27361	UNIPROT	RPTOR	PROTEIN	Q8N122	UNIPROT	Activates	Phosphorylation	Ser863	LTQSAPAsPTNKGVH	9606;9606							19346248	YES		Activation; protein conformation; phosphorylation;required for rheb-stimulated phosphorylation of s855 and s859;  necessary for phosphorylation of s859; mtorc1 activation; activates mtor towards p70s6k1 in response to insulin.	SIGNOR-112169	mtor_signaling
PTEN	PROTEIN	P60484	UNIPROT	AKT1	PROTEIN	P31749	UNIPROT	Inactivates	Dephosphorylation			9606;9606							20596030	NO		Exposure of eol-1r cells to imatinib failed to dephosphorylate akt, erk and stat5, although pdgfralpha was effectively inactivated. The forced expression of pten negatively regulated these signal pathways and sensitized eol-1r cells to imatinib.	SIGNOR-67820	mtor_signaling
INSR	PROTEIN	P06213	UNIPROT	INSR	PROTEIN	P06213	UNIPROT	Inactivates	Phosphorylation	Tyr1355	SLGFKRSyEEHIPYT	9606;9606		The effect was demonstrated using isoform P06213-2					2026614	YES		Mutation of the two carboxyl-terminal tyrosines results in an insulin receptor with normal metabolic signaling but enhanced mitogenic signaling properties.	SIGNOR-39508	mtor_signaling
MTOR	PROTEIN	P42345	UNIPROT	RPTOR	PROTEIN	Q8N122	UNIPROT	Activates	Phosphorylation	Ser863	LTQSAPAsPTNKGVH	9606;9606							19346248	YES		Ser863and ser859in raptor were phosphorylated by mtor bothin vivoandin vitro.	SIGNOR-112181	mtor_signaling
TSC2	PROTEIN	P49815	UNIPROT	TSC1	PROTEIN	Q92574	UNIPROT	Activates	Binding			9606;9606							10915759	YES		Furthermore, tsc2 is directly phosphorylated by akt, which is involved in stimulating cell growth and is activated by growth stimulating signals, such as insulin. Tsc2 is inactivated by akt-dependent phosphorylation, which destabilizes tsc2 and disrupts its interaction with tsc1.	SIGNOR-113837	mtor_signaling
MTOR	PROTEIN	P42345	UNIPROT	RPTOR	PROTEIN	Q8N122	UNIPROT	Activates	Phosphorylation	Ser859	DTSSLTQsAPASPTN	9606;9606							19346248	YES		Ser863and ser859in raptor were phosphorylated by mtor bothin vivoandin vitro.	SIGNOR-112102	mtor_signaling
GSK3B	PROTEIN	P49841	UNIPROT	SREBF1	PROTEIN	P36956	UNIPROT	Inactivates	Phosphorylation	Ser430	DTLTPPPsDAGSPFQ	9606;9606							16825193	YES		Gsk-3-mediated phosphorylation of thr-426 and ser-430 in the c terminus of mature srebp1 creates a docking site for fbw7 (also known as human cdc4), the substrate recognition component of a specific scf ubiquitin ligase	SIGNOR-73867	mtor_signaling
MAPK1	PROTEIN	P28482	UNIPROT	RPS6KB1	PROTEIN	P23443	UNIPROT	Activates	Phosphorylation	Ser447	GSPRTPVsPVKFSPG	9606;9606							21035469	YES		Erk phosphorylates multiple cytoplasmatic and cytoskeletal proteins, including mapk-activated protein kinases and the ribosomal p70-s6 kinase	SIGNOR-59860	mtor_signaling
INSR	PROTEIN	P06213	UNIPROT	INSR	PROTEIN	P06213	UNIPROT	Activates	Phosphorylation	Tyr1189	RDIYETDyYRKGGKG	9606;9606							11282018	YES		Insulin binding to its receptor results in receptor autophosphorylation on tyrosine residues and the tyrosine phosphorylation of insulin receptor substrates (irs-1, irs-2 and irs-3) by the insulin receptor tyrosine kinase.	SIGNOR-39407	mtor_signaling
PIK3CA	PROTEIN	P42336	UNIPROT	AKT1	PROTEIN	P31749	UNIPROT	Activates	Phosphorylation			9606;9606							10896679	YES		Pi3-k activates downstream molecules like protein kinase b (pkb).	SIGNOR-67801	mtor_signaling
MTOR	PROTEIN	P42345	UNIPROT	EIF4EBP1	PROTEIN	Q13541	UNIPROT	Inactivates	Phosphorylation	Thr70	RNSPVTKtPPRDLPT	9606;9606							23486913	YES		These results indicate that arg, leu, and gln act coordinately to stimulate proliferation of ptr cells through activation of the mtor-rps6k-rps6-eif4ebp1 signal transduction pathway. Specifically as part of mtorc1, mtor directly phosphorylates the ribosomal protein s6 kinases (s6k1 and s6k2) and the eukaryotic initiation factor 4e (eif4e)-binding proteins (4e-bp1 and 4e-bp2), both of which control specific steps in the initiation of cap-dependent translation	SIGNOR-101779	mtor_signaling
GSK3B	PROTEIN	P49841	UNIPROT	SREBF1	PROTEIN	P36956	UNIPROT	Inactivates	Phosphorylation	Thr426	TEVEDTLtPPPSDAG	9606;9606							16825193	YES		Gsk-3-mediated phosphorylation of thr-426 and ser-430 in the c terminus of mature srebp1 creates a docking site for fbw7 (also known as human cdc4), the substrate recognition component of a specific scf ubiquitin ligase	SIGNOR-73897	mtor_signaling
EIF4EBP1	PROTEIN	Q13541	UNIPROT	EIF4E	PROTEIN	P06730	UNIPROT	Inactivates	Binding			9606;9606							19339977	YES		The newly discovered eif4e-binding proteins described below interact with the eif4e on only specific mrnas.	SIGNOR-40443	mtor_signaling
MTOR	PROTEIN	P42345	UNIPROT	AKT1	PROTEIN	P31749	UNIPROT	Activates	Phosphorylation	Ser473	RPHFPQFsYSASGTA	9606;9606							23543412	YES			SIGNOR-68044	mtor_signaling
RPS6KB1	PROTEIN	P23443	UNIPROT	MTOR	PROTEIN	P42345	UNIPROT	Activates	Phosphorylation	Ser2448	RSRTRTDsYSAGQSV	9606;9606							19079619	YES		We show that s6 kinase 1 (s6k1), but not akt, directly phosphorylates mtor in cell-freeï¾ in vitroï¾ system and in cells.	SIGNOR-77140	mtor_signaling
MAPK3	PROTEIN	P27361	UNIPROT	PPARG	PROTEIN	P37231	UNIPROT	Inactivates	Phosphorylation	Ser112	AIKVEPAsPPYYSEK	9606;9606		The effect has been demonstrated using P37231-2					18596912	YES		The genomic activity of ppargamma is modulated, in addition to ligand binding, by phosphorylation of a serine residue by mapks, such as extracellular signal-regulated protein kinases-1/2 (erk-1/2), or by nucleocytoplasmic compartmentalization through the erk activators mapk kinases-1/2 (mek-1/2). These mapks phosphorylate (in humans) ser 84 in the ppargamma1 and ser 114 in ppargamma2 isoform	SIGNOR-74173	mtor_signaling
AKT2	PROTEIN	P31751	UNIPROT	AKT1S1	PROTEIN	Q96B36	UNIPROT	Inactivates	Phosphorylation			9606;9606							17277771	YES		Furthermore, pras40 phosphorylation by akt and association with 14-3-3, a cytosolic anchor protein, are crucial for insulin to stimulate mtor. These findings identify pras40 as an important regulator of insulin sensitivity of the akt-mtor pathway and a potential target for the treatment of cancers, insulin resistance and hamartoma syndromes.	SIGNOR-115693	mtor_signaling
MAPK3	PROTEIN	P27361	UNIPROT	RPS6KB1	PROTEIN	P23443	UNIPROT	Activates	Phosphorylation			9606;9606							14967450	YES		Erk phosphorylates multiple cytoplasmatic and cytoskeletal proteins, including mapk-activated protein kinases and the ribosomal p70-s6 kinase	SIGNOR-59851	mtor_signaling
PRKAA1	PROTEIN	Q13131	UNIPROT	ULK1	PROTEIN	O75385	UNIPROT	Activates	Phosphorylation			9606;9606							21460634	YES		Ampk and ulk1 interact and that the latter is phosphorylated by ampk. This phosphorylation leads to the direct activation of ulk1 by ampk bypassing mtor-inhibition.	SIGNOR-24988	mtor_signaling
GSK3B	PROTEIN	P49841	UNIPROT	SREBF1	PROTEIN	P36956	UNIPROT	Inactivates	Phosphorylation	Ser434	PPPSDAGsPFQSSPL	9606;9606							16825193	YES		Gsk-3-mediated phosphorylation of thr-426 and ser-430 in the c terminus of mature srebp1 creates a docking site for fbw7 (also known as human cdc4), the substrate recognition component of a specific scf ubiquitin ligase	SIGNOR-73880	mtor_signaling
INS	PROTEIN	P01308	UNIPROT	INSR	PROTEIN	P06213	UNIPROT	Activates	Binding			9606;9606							2550426	YES		It is proposed that the self-phosphorylated form of the receptor is the insulin-activated protein kinase that catalyzes the phosphorylation of exogenous protein and peptide substrates.	SIGNOR-39009	mtor_signaling
RPS6KB1	PROTEIN	P23443	UNIPROT	RPS6	PROTEIN	P62753	UNIPROT	Activates	Phosphorylation	Ser236	AKRRRLSsLRASTSK	9606;9606							15809305	YES		A knockin mouse carrying mutations at all phosphorylation sites in the primary s6k substrate, ribosomal protein s6 (rps6), has provided insight into the physiological role of this protein phosphorylation event. Of the many known substrates of s6k1, it is rps6 that has been shown to be directly involved, via its phosphorylation, in controlling cell size.	SIGNOR-89196	mtor_signaling
MTOR	PROTEIN	P42345	UNIPROT	IRS1	PROTEIN	P35568	UNIPROT	Inactivates	Phosphorylation	Ser307	TRRSRTEsITATSPA	9606;9606							15733744	NO		Mtor induced the serine phosphorylation of irs-1 (ser-636/639), and such phosphorylation was inhibited by rapamycin. These results suggest that tnf impairsinsulinsignaling through irs-1 by activation of a pi 3-kinase/akt/mtor pathway, which is antagonized by pten	SIGNOR-71902	mtor_signaling
MTOR	PROTEIN	P42345	UNIPROT	RPS6KB1	PROTEIN	P23443	UNIPROT	Activates	Phosphorylation	Thr412	NQVFLGFtYVAPSVL	9606;9606							23486913	YES		These results indicate that arg, leu, and gln act coordinately to stimulate proliferation of ptr cells through activation of the mtor-rps6k-rps6-eif4ebp1 signal transduction pathway.	SIGNOR-59926	mtor_signaling
RHEB	PROTEIN	Q15382	UNIPROT	MTOR	PROTEIN	P42345	UNIPROT	Activates	Binding			9606;9606							20006481	YES		Rheb stimulates the phosphorylation of mtor and plays an essential role in regulation of s6k and 4ebp1 in response to nutrients and cellular energy status.	SIGNOR-77068	mtor_signaling
MTOR	PROTEIN	P42345	UNIPROT	IRS1	PROTEIN	P35568	UNIPROT	Inactivates	Phosphorylation	Ser312	TESITATsPASMVGG	9606;9606							11287630	NO		Mtor induced the serine phosphorylation of irs-1 (ser-636/639), and such phosphorylation was inhibited by rapamycin. These results suggest that tnf impairsinsulinsignaling through irs-1 by activation of a pi 3-kinase/akt/mtor pathway, which is antagonized by pten	SIGNOR-71840	mtor_signaling
RPS6KB1	PROTEIN	P23443	UNIPROT	MTOR	PROTEIN	P42345	UNIPROT	Activates	Phosphorylation	Thr2446	NKRSRTRtDSYSAGQ	9606;9606							12807916	YES		We show that s6 kinase 1 (s6k1), but not akt, directly phosphorylates mtor in cell-freeï¾ in vitroï¾ system and in cells.	SIGNOR-77132	mtor_signaling
AKT2	PROTEIN	P31751	UNIPROT	TSC2	PROTEIN	P49815	UNIPROT	Inactivates	Phosphorylation	Ser939	SFRARSTsLNERPKS	9606;9606							12172553	YES		We demonstrate here that tuberin is phosphorylated on s939 and t1462 in response to pi3k activation. Our results are consistent with akt being the pi3k-depen-dent tuberin kinase. The pi3k-akt-mediated phosphorylation of tuberin would inhibit the function of the tuberin-hamartin complex.	SIGNOR-83447	mtor_signaling
