GNAS	PROTEIN	Q5JWF2	UNIPROT	ADCY1	PROTEIN	Q08828	UNIPROT	Activates	Binding			9606;9606							22863277	YES		Thus, Gs-coupled GPCR can induce YAP phosphorylation mainly via cAMP and PKA; GsÎ± but not any other GÎ± directly activates adenylyl cyclases.	SIGNOR-130065	hippo
LPAR1	PROTEIN	Q92633	UNIPROT	GNA12	PROTEIN	Q03113	UNIPROT	Activates	Binding			9606;9606							22863277	YES		Serum-borne lysophosphatidic acid (LPA) and sphingosine 1-phosphophate (S1P) act through G12/13-coupled receptors to inhibit the Hippo pathway kinases Lats1/2 thereby activating YAP and TAZ transcription co-activators, which are oncoproteins repressed by Lats1/2.	SIGNOR-129969	hippo
CDH1	PROTEIN	P12830	UNIPROT	CTNNA1	PROTEIN	P35221	UNIPROT	Activates	Binding			9606;9606							24336504	YES		In addition, the E cadherin-associated protein Î± catenin regulates YAP directly by sequestering YAPâ14 3 3 protein (also known as YWHAQ) complexes in the cytoplasm.	SIGNOR-130079	hippo
LATS1	PROTEIN	O95835	UNIPROT	WWTR1	PROTEIN	Q9GZV5	UNIPROT	Inactivates	Phosphorylation	Ser89	AQHVRSHsSPASLQL	9606;9606							21808241	YES	Together,the YAP/TAZ-TEAD complex promotes proliferative and survival programs.	Activated Lats1/2 in turn phosphorylate and inhibit YAP/TAZ transcription co-activators.	SIGNOR-118587	hippo
S1PR2	PROTEIN	O95136	UNIPROT	GNA13	PROTEIN	Q14344	UNIPROT	Activates	Binding			9606;9606							22863277	YES		Serum-borne lysophosphatidic acid (LPA) and sphingosine 1-phosphophate (S1P) act through G12/13-coupled receptors to inhibit the Hippo pathway kinases Lats1/2 thereby activating YAP and TAZ transcription co-activators, which are oncoproteins repressed by Lats1/2.	SIGNOR-129984	hippo
GCG	PROTEIN	P01275	UNIPROT	GCGR	PROTEIN	P47871	UNIPROT	Activates	Binding			9606;9606							12529935	YES			SIGNOR-81597	hippo
YAP1	PROTEIN	P46937	UNIPROT	TEAD1	PROTEIN	P28347	UNIPROT	Activates	Binding			9606;9606							21084559	YES	Crystallographic data revealed that the N-terminal TEAD-binding domain of YAP wraps around a globular structure formed by the C-terminal domains of TEAD1, 2 and 4	When dephosphorylated, YAP/TAZ enter nuclei and induce gene transcription by interacting with transcription factors TEAD14.	SIGNOR-64937	hippo
LPAR1	PROTEIN	Q92633	UNIPROT	GNA13	PROTEIN	Q14344	UNIPROT	Activates	Binding			9606;9606							22863277	YES		Serum-borne lysophosphatidic acid (LPA) and sphingosine 1-phosphophate (S1P) act through G12/13-coupled receptors to inhibit the Hippo pathway kinases Lats1/2 thereby activating YAP and TAZ transcription co-activators, which are oncoproteins repressed by Lats1/2.	SIGNOR-129972	hippo
LPAR1	PROTEIN	Q92633	UNIPROT	GNA12	PROTEIN	Q03113	UNIPROT	Activates	Binding			9606;9606							20331961	YES		The receptor, now called lpa1, is a gpcr that couples to heterotrimeric g proteins (gi, gq, g12/13alpha subunits). lysophosphatidic acid (lpa), a major g protein coupled receptor (gpcr)-activating ligand present in serum, elicits growth factor like responses by stimulating specific gpcrs coupled to heterotrimeric g proteins such as g(i), g(q), and g12/13.	SIGNOR-94114	hippo
YAP1	PROTEIN	P46937	UNIPROT	TEAD1	PROTEIN	P28347	UNIPROT	Activates	Binding			9606;9606							23431053	YES	Crystallographic data revealed that the N-terminal TEAD-binding domain of YAP wraps around a globular structure formed by the C-terminal domains of TEAD1, 2 and 4	When dephosphorylated, YAP/TAZ enter nuclei and induce gene transcription by interacting with transcription factors TEAD14.	SIGNOR-64941	hippo
F2	PROTEIN	P00734	UNIPROT	F2R	PROTEIN	P25116	UNIPROT	Activates	Binding			9606;9606							23450633	YES		Thrombin, actin through PAR1 promotes tumor cell proliferation, migration and contributes to the metastatic potenital of breast, prostate, gastrointestinal cancers and melanoma.	SIGNOR-129988	hippo
S1PR2	PROTEIN	O95136	UNIPROT	GNA13	PROTEIN	Q14344	UNIPROT	Activates	Binding			9606;9606							10488065	YES		Edg-3 and edg-5 couple not only to gibut also to gqand g13	SIGNOR-103150	hippo
LATS1	PROTEIN	O95835	UNIPROT	WWTR1	PROTEIN	Q9GZV5	UNIPROT	Inactivates	Phosphorylation	Ser89	AQHVRSHsSPASLQL	9606;9606							22658639	YES	Together,the YAP/TAZ-TEAD complex promotes proliferative and survival programs.	Activated Lats1/2 in turn phosphorylate and inhibit YAP/TAZ transcription co-activators.	SIGNOR-118591	hippo
STK4	PROTEIN	Q13043	UNIPROT	MOB1A	PROTEIN	Q9H8S9	UNIPROT	Activates	Phosphorylation	Thr12	FSSRSSKtFKPKKNI	9606;9606							23431053	YES	MOB1a and MOB1b are near identical to each other with protein sequence homology>90%, and more importantly, both of them are putative tumor suppressors.	Mob1, which forms a complex with Lats1/2, is also phosphorylated by Mst1/2, resulting in an enhanced Lats1/2Mob1 interaction.	SIGNOR-107877	hippo
STK4	PROTEIN	Q13043	UNIPROT	MOB1A	PROTEIN	Q9H8S9	UNIPROT	Activates	Phosphorylation	Thr35	LLKHAEAtLGSGNLR	9606;9606							21808241	YES	MOB1a and MOB1b are near identical to each other with protein sequence homology>90%, and more importantly, both of them are putative tumor suppressors.	Mob1, which forms a complex with Lats1/2, is also phosphorylated by Mst1/2, resulting in an enhanced Lats1/2Mob1 interaction.	SIGNOR-107889	hippo
GCG	PROTEIN	P01275	UNIPROT	GCGR	PROTEIN	P47871	UNIPROT	Activates	Binding			9606;9606							22863277	YES		In contrast, stimulation of Gs-coupled receptors by glucagon or epinephrine activates Lats1/2 kinase activity, thereby inhibiting YAP function.	SIGNOR-130009	hippo
F2	PROTEIN	P00734	UNIPROT	F2R	PROTEIN	P25116	UNIPROT	Activates	Cleavage			9606;9606							22318735	YES	Thrombin acts on protease-activated receptors (PARs), a subfamily of G protein-coupled receptors (GPCR) that participate in a variety of biological process, including chemokine and cytokine release, tissue remodeling, inflammation, proliferation, and angiogenesis.	The par1 receptor subtype is activated when the n terminus is proteolytically cleaved by the serine protease thrombin, resulting in an irreversible activation of the receptor. Thrombin activates platelets by binding and cleaving protease-activated receptors 1 and 4 (par1 and par4).	SIGNOR-62143	hippo
STK4	PROTEIN	Q13043	UNIPROT	MOB1A	PROTEIN	Q9H8S9	UNIPROT	Activates	Phosphorylation	Thr12	FSSRSSKtFKPKKNI	9606;9606							21808241	YES	MOB1a and MOB1b are near identical to each other with protein sequence homology>90%, and more importantly, both of them are putative tumor suppressors.	Mob1, which forms a complex with Lats1/2, is also phosphorylated by Mst1/2, resulting in an enhanced Lats1/2Mob1 interaction.	SIGNOR-107873	hippo
F2	PROTEIN	P00734	UNIPROT	F2R	PROTEIN	P25116	UNIPROT	Activates	Cleavage			9606;9606							11356985	YES	Thrombin acts on protease-activated receptors (PARs), a subfamily of G protein-coupled receptors (GPCR) that participate in a variety of biological process, including chemokine and cytokine release, tissue remodeling, inflammation, proliferation, and angiogenesis.	The par1 receptor subtype is activated when the n terminus is proteolytically cleaved by the serine protease thrombin, resulting in an irreversible activation of the receptor. Thrombin activates platelets by binding and cleaving protease-activated receptors 1 and 4 (par1 and par4).	SIGNOR-62146	hippo
F2	PROTEIN	P00734	UNIPROT	F2R	PROTEIN	P25116	UNIPROT	Activates	Cleavage			9606;9606							22972936	YES	Thrombin acts on protease-activated receptors (PARs), a subfamily of G protein-coupled receptors (GPCR) that participate in a variety of biological process, including chemokine and cytokine release, tissue remodeling, inflammation, proliferation, and angiogenesis.	The par1 receptor subtype is activated when the n terminus is proteolytically cleaved by the serine protease thrombin, resulting in an irreversible activation of the receptor. Thrombin activates platelets by binding and cleaving protease-activated receptors 1 and 4 (par1 and par4).	SIGNOR-62135	hippo
GCGR	PROTEIN	P47871	UNIPROT	GNAS	PROTEIN	Q5JWF2	UNIPROT	Activates	Binding			9606;9606							22863277	YES		In contrast, stimulation of Gs-coupled receptors by glucagon or epinephrine activates Lats1/2 kinase activity, thereby inhibiting YAP function.	SIGNOR-130059	hippo
STK4	PROTEIN	Q13043	UNIPROT	MOB1A	PROTEIN	Q9H8S9	UNIPROT	Activates	Phosphorylation	Thr35	LLKHAEAtLGSGNLR	9606;9606							23431053	YES	MOB1a and MOB1b are near identical to each other with protein sequence homology>90%, and more importantly, both of them are putative tumor suppressors.	Mob1, which forms a complex with Lats1/2, is also phosphorylated by Mst1/2, resulting in an enhanced Lats1/2Mob1 interaction.	SIGNOR-119005	hippo
WWTR1	PROTEIN	Q9GZV5	UNIPROT	TEAD1	PROTEIN	P28347	UNIPROT	Activates	Binding			9606;9606							23431053	YES	YAP/TAZ mainly bind to the transcription factors TEAD1Ã¯Â¾?4 to regulate genes involved in cell proliferation and cell death.	When dephosphorylated, yap/taz enter nuclei and induce gene transcription by interacting with transcription factors tead1ï¿½ï¿½?4.	SIGNOR-64944	hippo
F2R	PROTEIN	P25116	UNIPROT	LATS1	PROTEIN	O95835	UNIPROT	Inactivates				9606;9606							22972936	NO	Here we report that stimulation of protease-activated receptors (PARs) activates YAP/TAZ by decreasing phosphorylation and increasing nuclear localization.	PAR1 acts through G12/13 and Rho GTPase to inhibit the Lats1/2 kinase.	SIGNOR-29075	hippo
MOB1A	PROTEIN	Q9H8S9	UNIPROT	LATS1	PROTEIN	O95835	UNIPROT	Activates	Binding			9606;9606							21084559	YES	Lats1 and Lats2 are nuclear Dbf2-related (NDR) family protein kinases.	LATS1/2 are activated by association with the highly homologous scaffold proteins Mps one binder kinase activator-like 1A (MOBKL1A) and 1B (MOBKL1B), which are collectively referred to as Mob1	SIGNOR-29142	hippo
STK4	PROTEIN	Q13043	UNIPROT	LATS1	PROTEIN	O95835	UNIPROT	Activates	Phosphorylation	Thr1079	EHAFYEFtFRRFFDD	9606;9606							15688006	YES		Activation of mst1/2 leads to phosphorylation and activation of their direct substrates, lats1/2.	SIGNOR-29147	hippo
STK4	PROTEIN	Q13043	UNIPROT	LATS1	PROTEIN	O95835	UNIPROT	Activates	Phosphorylation	Ser909	HQRCLAHsLVGTPNY	9606;9606							15688006	YES		Activation of mst1/2 leads to phosphorylation and activation of their direct substrates, lats1/2.	SIGNOR-29196	hippo
S1PR2	PROTEIN	O95136	UNIPROT	GNA12	PROTEIN	Q03113	UNIPROT	Activates	Binding			9606;9606							22863277	YES		Serum-borne lysophosphatidic acid (LPA) and sphingosine 1-phosphophate (S1P) act through G12/13-coupled receptors to inhibit the Hippo pathway kinases Lats1/2 thereby activating YAP and TAZ transcription co-activators, which are oncoproteins repressed by Lats1/2.	SIGNOR-129981	hippo
F2R	PROTEIN	P25116	UNIPROT	GNA13	PROTEIN	Q14344	UNIPROT	Activates	Binding			9606;9606							17158345	YES		Upon proteolysis, the newly formed n terminus acts as a tethered ligand that activates the receptor and initiates signaling cascades through multiple g proteins (galfaq, galfai, and galfa12/13).	SIGNOR-103157	hippo
GNA12	PROTEIN	Q03113	UNIPROT	RHOA	PROTEIN	P61586	UNIPROT	Activates	Binding			9606;9606							23450633	YES		Ga12/13 recruitment of Rho-GEFs causes RhoA activation and F-actin assembly, which promotes Lats1/Lat2 inactivation by an unknown, but myosin-independent mechanism.	SIGNOR-129997	hippo
CTNNA1	PROTEIN	P35221	UNIPROT	YAP1	PROTEIN	P46937	UNIPROT	Inactivates	Binding			9606;9606							23431053	YES	In keratinocytes, YAP strongly interacts with a-catenin, and this interaction is mediated by 14-3-3.	The trimeric complex of alfa-catenin, 14-3-3, and YAP sequesters YAP at AJs and prevents YAP dephosphorylation/activation.	SIGNOR-81321	hippo
GNAS	PROTEIN	Q5JWF2	UNIPROT	ADCY1	PROTEIN	Q08828	UNIPROT	Activates	Binding			9606;9606							17652154	YES		Thus, Gs-coupled GPCR can induce YAP phosphorylation mainly via cAMP and PKA; GsÎ± but not any other GÎ± directly activates adenylyl cyclases.	SIGNOR-130068	hippo
GNA13	PROTEIN	Q14344	UNIPROT	RHOA	PROTEIN	P61586	UNIPROT	Activates	Binding			9606;9606							23450633	YES		Ga12/13 recruitment of Rho-GEFs causes RhoA activation and F-actin assembly, which promotes Lats1/Lat2 inactivation by an unknown, but myosin-independent mechanism.	SIGNOR-130000	hippo
LATS1	PROTEIN	O95835	UNIPROT	YAP1	PROTEIN	P46937	UNIPROT	Inactivates	Phosphorylation	Ser127	PQHVRAHsSPASLQL	9606;9606							22658639	YES		Uninhibited yap/taz localize to the nucleus where they serve as coactivators for the tea-domain family member (tead) of dna-binding transcription factors; activated lats1/2 phosphorylates the ww-domain containing transcriptional coactivators yap at ser127 and taz at ser89, promoting 14-3-3 binding and thereby inhibiting their translocation into the nucleus.	SIGNOR-81519	hippo
F2R	PROTEIN	P25116	UNIPROT	GNA13	PROTEIN	Q14344	UNIPROT	Activates				9606;9606							22972936	YES		PAR1 acts through G12/13 and Rho GTPase to inhibit the Lats1/2 kinase.	SIGNOR-129994	hippo
GCG	PROTEIN	P01275	UNIPROT	LATS1	PROTEIN	O95835	UNIPROT	Activates	Chemical activation			9606;9606							23075495	NO		On the other hand, Galfas-coupled signals, such as epinephrine and glucagon, induce kinase activity of Lats1/2, leading to phosphorylation and YAP/TAZ.	SIGNOR-28985	hippo
F2R	PROTEIN	P25116	UNIPROT	GNA12	PROTEIN	Q03113	UNIPROT	Activates				9606;9606							22972936	YES		PAR1 acts through G12/13 and Rho GTPase to inhibit the Lats1/2 kinase.	SIGNOR-129991	hippo
LPAR1	PROTEIN	Q92633	UNIPROT	GNA12	PROTEIN	Q03113	UNIPROT	Activates	Binding			9606;9606							15856019	YES		The receptor, now called lpa1, is a gpcr that couples to heterotrimeric g proteins (gi, gq, g12/13alpha subunits). lysophosphatidic acid (lpa), a major g protein coupled receptor (gpcr)-activating ligand present in serum, elicits growth factor like responses by stimulating specific gpcrs coupled to heterotrimeric g proteins such as g(i), g(q), and g12/13.	SIGNOR-94117	hippo
TAOK1	PROTEIN	Q7L7X3	UNIPROT	STK4	PROTEIN	Q13043	UNIPROT	Activates	Phosphorylation			9606;9606							23431053	YES		In addition, the thousand-and-one (TAO) amino acids kinase or TAOK13 has been shown to directly phosphorylate and activate Hpo or MST1/2.	SIGNOR-98985	hippo
PRKACA	PROTEIN	P17612	UNIPROT	LATS1	PROTEIN	O95835	UNIPROT	Activates	Phosphorylation			9606;9606							23644383	YES		Here, we show that cyclic AMP (cAMP)-dependent protein kinase (PKA) phosphorylates LATS and thereby enhances its activity sufficiently to phosphorylate YAP on Ser381.	SIGNOR-130072	hippo
F2R	PROTEIN	P25116	UNIPROT	GNA13	PROTEIN	Q14344	UNIPROT	Activates	Binding			9606;9606							22318735	YES		Upon proteolysis, the newly formed n terminus acts as a tethered ligand that activates the receptor and initiates signaling cascades through multiple g proteins (galfaq, galfai, and galfa12/13).	SIGNOR-103160	hippo
F2	PROTEIN	P00734	UNIPROT	F2R	PROTEIN	P25116	UNIPROT	Activates	Cleavage			9606;9606							17595115	YES	Thrombin acts on protease-activated receptors (PARs), a subfamily of G protein-coupled receptors (GPCR) that participate in a variety of biological process, including chemokine and cytokine release, tissue remodeling, inflammation, proliferation, and angiogenesis.	The par1 receptor subtype is activated when the n terminus is proteolytically cleaved by the serine protease thrombin, resulting in an irreversible activation of the receptor. Thrombin activates platelets by binding and cleaving protease-activated receptors 1 and 4 (par1 and par4).	SIGNOR-62139	hippo
SAV1	PROTEIN	Q9H4B6	UNIPROT	STK4	PROTEIN	Q13043	UNIPROT	Activates	Binding			9606;9606							21084559	YES	Sav1 interacts with Mst1/2 through the SARAH domains present in both Sav1 and Mst1/2.	Mst is activated by binding of Salvador (Sav1, Sav in Drosophila), which is, in turn, also phosphorylated by Mst.	SIGNOR-99068	hippo
RPS6KA1	PROTEIN	Q15418	UNIPROT	BAD	PROTEIN	Q92934	UNIPROT	Inactivates	Phosphorylation	Ser75	EIRSRHSsYPAGTED	9606;9606							18794113	YES		The rsks catalyze the phosphorylation of the pro-apoptotic protein bad at serine 112 to promote cell survival.	SIGNOR-114662	inhibition_apoptosis
SOS1	PROTEIN	Q07889	UNIPROT	NRAS	PROTEIN	P01111	UNIPROT	Activates	Guanine nucleotide exchange factor			9606;9606							11560935	YES		GRB2 binds and activates SOS, which then activates RAS, and this activates p110 independently of p85.	SIGNOR-31695	inhibition_apoptosis
EGFR	PROTEIN	P00533	UNIPROT	EGFR	PROTEIN	P00533	UNIPROT	Activates	Phosphorylation	Tyr1092	TFLPVPEyINQSVPK	9606;9606							10653583	YES	Dimerization mediated by a beta hairpin, which protudes from the S1 domains of each ligand bound monomer	After binding of epidermal growth factor (EGF), the EGF receptor (EGFR) becomes autophosphorylated via tyrosine. |The autonomous receptor erbb1 binds to multiple ligands and forms homodimers, as well as three functional heterodimers.|Egfr possesses three major and two minor tyrosine autophosphorylation sites located at y1068, y1148, y1173, and at y992 and y1086 respectively.	SIGNOR-31323	inhibition_apoptosis
MAP3K7	PROTEIN	O43318	UNIPROT	NFKB1	PROTEIN	P19838	UNIPROT	Activates	Transcriptional activation			9606;9606							9480845	YES		These results suggest that tak1 induces nf-kappa b activation through a novel nik-independent signaling pathway.	SIGNOR-56904	inhibition_apoptosis
AKT1	PROTEIN	P31749	UNIPROT	BAD	PROTEIN	Q92934	UNIPROT	Inactivates	Phosphorylation	Ser118	GRELRRMsDEFVDSF	9606;9606							9346240	YES		Experiments in this study reveal that akt phosphorylates bad both in vitro and in vivo and that akt-mediated phosphorylation of bad effectively blocks bad induced cell death.[...] In addition, these findings implicate a particular phosphorylation site on bad, serine 136, in the suppression of bad-mediated death by akt.[...]The Phosphorylation of bad may lead to the prevention of cell death via a mechanism that involves the selective association of the phosphorylated forms of bad with 14-3-3 protein isoforms. Akt phosphorylates bad in vitro and in vivo we show that growth factor activation of the pi3'k/akt signaling pathway culminates in the phosphorylation of the bcl-2 family member bad, thereby suppressing apoptosis and promoting cell survival. Akt phosphorylates bad in vitro and in vivo erbb-mediated phosphorylation of bad by akt promotes survival by blocking the interaction of this pro-apoptotic molecule with bcl-2 and bcl-x proteins	SIGNOR-114700	inhibition_apoptosis
MAPK1	PROTEIN	P28482	UNIPROT	BAD	PROTEIN	Q92934	UNIPROT	Activates	Phosphorylation			9606;9606							8929531	YES		The rapid phosphorylation of bad following il-3 connects a proximal survival signal with the bcl-2 family, modulating this checkpoint for apoptosis.	SIGNOR-114504	inhibition_apoptosis
MAP3K7	PROTEIN	O43318	UNIPROT	NFKBIA	PROTEIN	P25963	UNIPROT	Inactivates	Phosphorylation			9606;9606							9480845	YES		Overexpression ofï¾ tak1ï¾ together with its activator protein,ï¾ tak1ï¾ binding protein 1 (tab1), induced theï¾ nuclearï¾ translocation of nf-kappa b p50/p65 heterodimer accompanied by the degradation of i kappa b alpha and i kappa b beta, and the expression of kappa b-dependent reporter gene.	SIGNOR-62528	inhibition_apoptosis
MAPK1	PROTEIN	P28482	UNIPROT	FOXO3	PROTEIN	O43524	UNIPROT	Inactivates	Phosphorylation	Ser425	TKGSGLGsPTSSFNS	9606;9606							18204439	YES		Here, we show that erk downregulates forkhead box o 3a (foxo3a) by directly interacting with and phosphorylating foxo3a at ser 294, ser 344 and ser 425, which consequently promotes cell proliferation and tumorigenesis	SIGNOR-21483	inhibition_apoptosis
AKT1	PROTEIN	P31749	UNIPROT	BCL2L11	PROTEIN	O43521	UNIPROT	Inactivates	Phosphorylation	Ser87	FIFMRRSsLLSRSSS	9606;9606							16282323	YES		Akt phosphorylation site in the bim(el) domain as ser(87).	SIGNOR-20853	inhibition_apoptosis
CASP3	PROTEIN	P42574	UNIPROT	IKBKB	PROTEIN	O14920	UNIPROT	Inactivates	Cleavage	Asp78	PNVVAARdVPEGMQN	9606;9606							11741536	YES		Ikappab kinase (ikk) beta was specifically proteolyzed by caspase-3-related caspases at aspartic acid residues 78, 242, 373, and 546 during tumor necrosis factor (tnf)-alpha-induced apoptosis.	SIGNOR-14946	inhibition_apoptosis
TNF	PROTEIN	P01375	UNIPROT	PIK3CA	PROTEIN	P42336	UNIPROT	Activates				9606;9606							10485710	YES		Tnf activates phosphatidylinositol-3-oh kinase (pi(3)k).	SIGNOR-76476	inhibition_apoptosis
EGFR	PROTEIN	P00533	UNIPROT	EGFR	PROTEIN	P00533	UNIPROT	Activates	Phosphorylation	Tyr1016	DVVDADEyLIPQQGF	9606;9606							10653583	YES	Dimerization mediated by a beta hairpin, which protudes from the S1 domains of each ligand bound monomer	After binding of epidermal growth factor (EGF), the EGF receptor (EGFR) becomes autophosphorylated via tyrosine. |The autonomous receptor erbb1 binds to multiple ligands and forms homodimers, as well as three functional heterodimers.|Egfr possesses three major and two minor tyrosine autophosphorylation sites located at y1068, y1148, y1173, and at y992 and y1086 respectively.	SIGNOR-31254	inhibition_apoptosis
CREB1	PROTEIN	P16220	UNIPROT	BCL2	PROTEIN	P10415	UNIPROT	Activates	Transcriptional activation			9606;9606							8816467	YES		10753867/creb activity by akt signaling leads to increased bcl-2 promoter activity and cell survival.	SIGNOR-45335	inhibition_apoptosis
MAP2K2	PROTEIN	P36507	UNIPROT	MAPK1	PROTEIN	P28482	UNIPROT	Activates	Phosphorylation	Thr185	HDHTGFLtEYVATRW	9606;9606							11971971	YES		MAPK1 is phosphorylated by MAP2K1/MEK1 and MAP2K2/MEK2 on Thr-185 and Tyr-187 in response to external stimuli like insulin or NGF. Both phosphorylations are required for activity.	SIGNOR-65123	inhibition_apoptosis
IKBKB	PROTEIN	O14920	UNIPROT	NFKB1	PROTEIN	P19838	UNIPROT	Inactivates	Phosphorylation	Ser927	DSDSVCDsGVETSFR	9606;9606							10469655	YES		Ikkbeta phosphorylates p105 resulting in its degradation, which releases tpl2 resulting in activation of the pro-proliferative map kinase- pathway.	SIGNOR-57141	inhibition_apoptosis
BRAF	PROTEIN	P15056	UNIPROT	MAP2K2	PROTEIN	P36507	UNIPROT	Activates	Phosphorylation	Ser222	VSGQLIDsMANSFVG	9606;9606							19106095	YES		Active RAF phosphorylates MEK.	SIGNOR-72831	inhibition_apoptosis
XIAP	PROTEIN	P98170	UNIPROT	CASP9	PROTEIN	P55211	UNIPROT	Inactivates	Binding			9606;9606							9545235	YES		This paper reports the crystal structure of caspase-9 in an inhibitory complex with the third baculoviral iap repeat (bir3) of xiap at 2.4 a resolution. X-linked inhibitor-of-apoptosis protein (xiap) interacts with caspase-9 and inhibits its activity.	SIGNOR-86982	inhibition_apoptosis
CASP3	PROTEIN	P42574	UNIPROT	IKBKB	PROTEIN	O14920	UNIPROT	Inactivates	Cleavage	Asp242	VRQKSEVdIVVSEDL	9606;9606							11741536	YES		Ikappab kinase (ikk) beta was specifically proteolyzed by caspase-3-related caspases at aspartic acid residues 78, 242, 373, and 546 during tumor necrosis factor (tnf)-alpha-induced apoptosis.	SIGNOR-14958	inhibition_apoptosis
TRADD	PROTEIN	Q15628	UNIPROT	TNFRSF1A	PROTEIN	P19438	UNIPROT	Activates	Binding			9606;9606							21232017	YES		Tradd contain a c-terminal death domain which mediates binding to the death domain of tnfr1	SIGNOR-56441	inhibition_apoptosis
MAPK1	PROTEIN	P28482	UNIPROT	FOXO3	PROTEIN	O43524	UNIPROT	Inactivates	Phosphorylation	Ser294	QLSKWPGsPTSRSSD	9606;9606							18204439	YES		Here, we show that erk downregulates forkhead box o 3a (foxo3a) by directly interacting with and phosphorylating foxo3a at ser 294, ser 344 and ser 425, which consequently promotes cell proliferation and tumorigenesis	SIGNOR-21324	inhibition_apoptosis
XIAP	PROTEIN	P98170	UNIPROT	CASP7	PROTEIN	P55210	UNIPROT	Inactivates	Binding			9606;9606							11583623	YES		XIAP is an endogenous inhibitor of caspase-7	SIGNOR-132656	inhibition_apoptosis
MAPK1	PROTEIN	P28482	UNIPROT	SOS1	PROTEIN	Q07889	UNIPROT	Inactivates	Phosphorylation	Ser1193	QPTSKAYsPRYSISD	9606;9606							8816480	YES		In this report, we describe the identification of five MAP kinase sites (S-1137, S-1167, S-1178, S-1193, and S-1197) on hSos1	SIGNOR-131408	inhibition_apoptosis
MAPK1	PROTEIN	P28482	UNIPROT	RPS6KA1	PROTEIN	Q15418	UNIPROT	Activates	Phosphorylation	Thr573	AENGLLMtPCYTANF	9606;9606							19282669	YES		Erk-activates the rsk family of serine/threonine kinases, rsk1, rsk2, and rsk3.	SIGNOR-105217	inhibition_apoptosis
CASP3	PROTEIN	P42574	UNIPROT	AKT1	PROTEIN	P31749	UNIPROT	Inactivates	Cleavage			9606;9606							10579725	YES		P53 can inhibit the survival function of integrins by inducing the caspase-dependent cleavage and inactivation of the serine/threonine kinase akt/pkb;the involvement of caspase 3 in akt/pkb regulation was indicated by the ability of z-devd-fmk, a caspase 3 inhibitor, to block the alpha6beta4-associated reduction in akt/pkb levels in vivo, and by the ability of recombinant caspase 3 to promote the cleavage of akt/pkb in vitro	SIGNOR-67805	inhibition_apoptosis
MAPK1	PROTEIN	P28482	UNIPROT	SOS1	PROTEIN	Q07889	UNIPROT	Inactivates	Phosphorylation			9606;9606							7478566	YES		These findings suggest a potential inhibitory role for MAP-kinase in attenuating nucleotide exchange on Ras, by uncoupling mSos1 from membrane-bound receptor complexes that lead to Ras activation.	SIGNOR-131392	inhibition_apoptosis
IKBKB	PROTEIN	O14920	UNIPROT	NFKB1	PROTEIN	P19838	UNIPROT	Inactivates	Phosphorylation	Ser923	DELRDSDsVCDSGVE	9606;9606							10469655	YES		Ikkbeta phosphorylates p105 resulting in its degradation, which releases tpl2 resulting in activation of the pro-proliferative map kinase- pathway.	SIGNOR-57062	inhibition_apoptosis
CASP3	PROTEIN	P42574	UNIPROT	NFKBIA	PROTEIN	P25963	UNIPROT	Inactivates	Chemical inhibition			9606;9606							9367996	YES		The cell-death protease cpp32 (caspase-3) in vitro specifically cleaved chicken and human ikappab-alpha at a conserved asp-ser sequence.	SIGNOR-62535	inhibition_apoptosis
