DVL1	PROTEIN	O14640	UNIPROT	CTNNB1	PROTEIN	P35222	UNIPROT	Activates	Binding			9606;9606							18347072	YES		In this study, we discovered two novel interactions between Dvl and c-Jun and between Dvl and beta-catenin in the nucleus that mediate the formation of a Dvlc-Junbeta-cateninTCF functional complex. Activated DVL binds and inhibits the phosphorylation of beta catenin by GSK3beta/alfa, blocking beta catenin degradation), so that beta catenin accumulates and translocates to the nucleus, where it interacts with the T cell specific factor (TCF)/lymphoid enhancer binding factor 1 (LEF-1) transcription factor and induces the transcription of target genes such as c-jun, c-myc, and cyclin D1.	SIGNOR-69992	wnt_myogenesis
CTNNB1	PROTEIN	P35222	UNIPROT	MYOD1	PROTEIN	P15172	UNIPROT	Activates	Binding			9606;9606							18316399	YES		We showed that beta-catenin interacts directly with MyoD, a basic helix-loop-helix transcription factor essential for muscle differentiation and enhances its binding to E box elements and transcriptional activity.	SIGNOR-131131	wnt_myogenesis
CREB1	PROTEIN	P16220	UNIPROT	PAX3	PROTEIN	P23760	UNIPROT	Activates	transcriptional activation			9606;9606							21902831	YES		Chen et al. showed that phosphorylated CREB is present at high levels in cells of the dermomyotome that express Pax3, MyoD and Myf5 and that this phosphorylation is critical for the induction of these genes.	SIGNOR-131312	wnt_myogenesis
RAC1	PROTEIN	P63000	UNIPROT	MAPK8	PROTEIN	P45983	UNIPROT	Activates				9606;9606							23151663	YES		Planar cell polarity (PCP) signalling triggers activation of the small GTPases RHOA and RAC1, which in turn activate RHO kinase (ROCK) and JUN-N-terminal kinase (JNK), respectively, leading to actin polymerization and microtubule stabilization.	SIGNOR-131282	wnt_myogenesis
GSK3B	PROTEIN	P49841	UNIPROT	CTNNB1	PROTEIN	P35222	UNIPROT	Inactivates	Phosphorylation	Thr41	GIHSGATtTAPSLSG	9606;9606							11955436	YES		Beta-catenin phosphorylation in vivo is sequentially carried out by two distinct kinases, CKIalfa and GSK-3. CKIalfa phosphorylation of S45 proceeds and is required for subsequent GSK-3 phosphorylation of T41, S37, and S33| One key substrate of GSK3 is the transcriptional co-activator beta catenin, whichis inactivated by GSK3 mediated phosphorylation and targeted for proteasomal degradation in unstimulated cells.	SIGNOR-70704	wnt_myogenesis
MAPK8	PROTEIN	P45983	UNIPROT	JUN	PROTEIN	P05412	UNIPROT	Activates	Phosphorylation	Ser73	VGLLKLAsPELERLI	9606;9606							12040039	YES		Stress in primary cultured cns neurons induces phosphorylation of c-jun serines 63 and 73 and increased c-jun protein. Jnk2/3 activity selectively targets c-jun.	SIGNOR-38408	wnt_myogenesis
AXIN1	PROTEIN	O15169	UNIPROT	APC	PROTEIN	P25054	UNIPROT	Activates	Binding			9606;9606							9734785	YES		Axin, an inhibitor of the Wnt pathway, interacts with beta-catenin, GSK-3beta and APC and reduces the beta-catenin level.	SIGNOR-61538	wnt_myogenesis
MAPK8	PROTEIN	P45983	UNIPROT	JUN	PROTEIN	P05412	UNIPROT	Activates	Phosphorylation	Ser73	VGLLKLAsPELERLI	9606;9606							9405416	YES	Phosphorylation of c-Jun on Ser73 by JNK is sufficient to protect c-Jun from ubiquitination.	Phosphorylation by activated jnk protects c-jun from ubiquitination.	SIGNOR-38412	wnt_myogenesis
GSK3B	PROTEIN	P49841	UNIPROT	AXIN1	PROTEIN	O15169	UNIPROT	Activates	Phosphorylation			9606;9606							23579495	YES		Axin, an inhibitor of the wnt pathway, interacts with beta-catenin, gsk-3beta and apc and reduces the beta-catenin level. Phosphorylation by gsk3 kept axin activated (open) for beta-catenin interaction and poised for engagement of lrp6.	SIGNOR-17200	wnt_myogenesis
PAX3	PROTEIN	P23760	UNIPROT	MYF5	PROTEIN	P13349	UNIPROT	Activates	Transcriptional activation			9606;9606							23384562	NO		Direct molecular regulation of the myogenic determination gene myf5 by pax3, with modulation by six1/4factors, is exemplified by the -111 kb-myf5 enhancer.	SIGNOR-48518	wnt_myogenesis
DVL1	PROTEIN	O14640	UNIPROT	RAC1	PROTEIN	P63000	UNIPROT	Activates	Binding			9606;9606							19365405	YES		b-Catenin-independent Wnt signaling can activate Rho family GTPases through at least two mechanisms: (1) direct activation of Rac1 by DVL; and (2) activation of RhoA via DVL-associated activator of morphogenesis-1 (Daam1), possibly through the weak-similarity guaninenucleotide exchange factor (WGEF)1.	SIGNOR-131088	wnt_myogenesis
GSK3B	PROTEIN	P49841	UNIPROT	CTNNB1	PROTEIN	P35222	UNIPROT	Inactivates	Phosphorylation	Ser37	YLDSGIHsGATTTAP	9606;9606							19303846	YES		Beta-catenin phosphorylation in vivo is sequentially carried out by two distinct kinases, CKIalfa and GSK-3. CKIalfa phosphorylation of S45 proceeds and is required for subsequent GSK-3 phosphorylation of T41, S37, and S33| One key substrate of GSK3 is the transcriptional co-activator beta catenin, whichis inactivated by GSK3 mediated phosphorylation and targeted for proteasomal degradation in unstimulated cells.	SIGNOR-70758	wnt_myogenesis
WNT7A	PROTEIN	O00755	UNIPROT	LRP5	PROTEIN	O75197	UNIPROT	Activates	Binding			9606;9606							15578921	YES		Wnt proteins bind to the frizzled receptors and lrp5/6 co-receptors, and through stabilizing the critical mediator beta-catenin, initiate a complex signaling cascade that plays an important role in regulating cell proliferation and differentiation.	SIGNOR-24393	wnt_myogenesis
CTNNB1	PROTEIN	P35222	UNIPROT	LEF1	PROTEIN	Q9UJU2	UNIPROT	Activates	Binding			9606;9606							15735151	YES		Activated dvl binds and inhibits the phosphorylation of beta catenin by gsk3beta/alfa, blocking beta catenin degradation (fig 2?2),), so that beta catenin accumulates and translocates to the nucleus, where it interacts with the t cell specific factor (tcf)/lymphoid enhancer binding factor 1 (lef-1) transcription factor and induces the transcription of target genes such as c-jun, c-myc, and cyclin d1	SIGNOR-121131	wnt_myogenesis
WNT1	PROTEIN	P04628	UNIPROT	LRP5	PROTEIN	O75197	UNIPROT	Activates	Binding			9606;9606							21078818	YES		Ligands such as Wnt1, Wnt3a, and Wnt8 couple the seventransmembrane domain receptor Frizzled (Fzd) and the single-membrane-spanning low-density receptor-related protein 5/6 (LRP5/6) to activate Wntâb-catenin signaling.	SIGNOR-131273	wnt_myogenesis
FZD7	PROTEIN	O75084	UNIPROT	GNAS	PROTEIN	P63092	UNIPROT	Activates	Binding			9606;9606							22944199	YES		Wnt7a binding to Fzd7 activates PI3K through a G protein alpha S- dependent mechanism.	SIGNOR-131334	wnt_myogenesis
WNT1	PROTEIN	P04628	UNIPROT	LRP6	PROTEIN	O75581	UNIPROT	Activates	Binding			9606;9606							15578921	YES		Wnt proteins bind to the Frizzled receptors and LRP5/6 co-receptors, and through stabilizing the critical mediator beta-catenin, initiate a complex signaling cascade that plays an important role in regulating cell proliferation and differentiation.	SIGNOR-25429	wnt_myogenesis
ROCK1	PROTEIN	Q13464	UNIPROT	PPP1R12A	PROTEIN	O14974	UNIPROT	Activates	Phosphorylation			9606;9606							18369372	YES		ROCK phosphorylates both the myosin binding subunit of myosin light chain phosphatase and the myosin regulatory light chain, which induces the actinâmyosin 2 interaction and promotes actin cytoskeleton assembly and cell contractility	SIGNOR-131098	wnt_myogenesis
FZD1	PROTEIN	Q9UP38	UNIPROT	DVL1	PROTEIN	O14640	UNIPROT	Activates	Binding			9606;9606							22944199	YES		When canonical Wnts bind to their respective Fzd receptors, heterotrimeric G-proteins and Dsh get activated and lead to the recruitment of Axin to the Fzd co-receptor LRP.	SIGNOR-131148	wnt_myogenesis
WNT7A	PROTEIN	O00755	UNIPROT	LRP6	PROTEIN	O75581	UNIPROT	Activates	Binding			9606;9606							15578921	YES		Wnt proteins bind to the frizzled receptors and lrp5/6 co-receptors, and through stabilizing the critical mediator beta-catenin, initiate a complex signaling cascade that plays an important role in regulating cell proliferation and differentiation.	SIGNOR-25344	wnt_myogenesis
LRP6	PROTEIN	O75581	UNIPROT	GSK3B	PROTEIN	P49841	UNIPROT	Inactivates	Binding			9606;9606							19107203	YES	PPPSPxS motif in LRP6/5 must be phosphorylated.	These observations demonstrate that phosphorylated lrp6/5 both recruits and directly inhibits gsk3beta using two distinct portions of its cytoplasmic sequence binding of wnts to the coreceptors frizzled and lrp6/5 leads to phosphorylation of pppspxs motifs in the lrp6/5 intracellular region and the inhibition of gsk3beta bound to the scaffold protein axin.These Observations demonstrate that phosphorylated lrp6/5 both recruits and directly inhibits gsk3beta using two distinct portions of its cytoplasmic sequence.	SIGNOR-83594	wnt_myogenesis
WNT3A	PROTEIN	P56704	UNIPROT	LRP5	PROTEIN	O75197	UNIPROT	Activates	Binding			9606;9606							15578921	YES		Wnt proteins bind to the frizzled receptors and lrp5/6 co-receptors, and through stabilizing the critical mediator beta-catenin, initiate a complex signaling cascade that plays an important role in regulating cell proliferation and differentiation.	SIGNOR-24491	wnt_myogenesis
GSK3B	PROTEIN	P49841	UNIPROT	LRP6	PROTEIN	O75581	UNIPROT	Activates	Phosphorylation	Ser1490	AILNPPPsPATERSH	9606;9606							16341017	YES		Glycogen synthase kinase 3 (gsk3), which is known for its inhibitory role in wnt through the promotion of beta-catenin phosphorylation and degradation, mediates the phosphorylation and activation of lrp6. We show that wnt induces sequential phosphorylation of lrp6 by gsk3 and casein kinase 1, and this dual phosphorylation promotes the engagement of lrp6 with the scaffolding protein axin.	SIGNOR-26482	wnt_myogenesis
GSK3B	PROTEIN	P49841	UNIPROT	CTNNB1	PROTEIN	P35222	UNIPROT	Inactivates	Phosphorylation	Thr41	GIHSGATtTAPSLSG	9606;9606							19303846	YES		Beta-catenin phosphorylation in vivo is sequentially carried out by two distinct kinases, CKIalfa and GSK-3. CKIalfa phosphorylation of S45 proceeds and is required for subsequent GSK-3 phosphorylation of T41, S37, and S33| One key substrate of GSK3 is the transcriptional co-activator beta catenin, whichis inactivated by GSK3 mediated phosphorylation and targeted for proteasomal degradation in unstimulated cells.	SIGNOR-70717	wnt_myogenesis
PAX3	PROTEIN	P23760	UNIPROT	PITX2	PROTEIN	Q99697	UNIPROT	Activates	transcriptional activation			9606;9606							21143873	YES		Pitx genes, such as Pitx2, which is positively regulated by Pax3, have been implicated in myogenesis.	SIGNOR-131297	wnt_myogenesis
GSK3B	PROTEIN	P49841	UNIPROT	CTNNB1	PROTEIN	P35222	UNIPROT	Inactivates	Phosphorylation	Ser37	YLDSGIHsGATTTAP	9606;9606							16293724	YES		Beta-catenin phosphorylation in vivo is sequentially carried out by two distinct kinases, CKIalfa and GSK-3. CKIalfa phosphorylation of S45 proceeds and is required for subsequent GSK-3 phosphorylation of T41, S37, and S33| One key substrate of GSK3 is the transcriptional co-activator beta catenin, whichis inactivated by GSK3 mediated phosphorylation and targeted for proteasomal degradation in unstimulated cells.	SIGNOR-70754	wnt_myogenesis
APC	PROTEIN	P25054	UNIPROT	CTNNB1	PROTEIN	P35222	UNIPROT	Inactivates	Binding			9606;9606							22083140	YES		The role of APC is less clear, but it clearly binds to both b-catenin and Axin, and could shuttle b-catenin from the plasma membrane and nucleus to the cytoplasmic Axin complex.	SIGNOR-131124	wnt_myogenesis
WNT11	PROTEIN	O96014	UNIPROT	FZD6	PROTEIN	O60353	UNIPROT	Activates	Binding			9606;9606							16273260	YES		Human Wnt5A, Wnt5B and Wnt11 are non-canonical Wnt ligands transducing PCP signals through FZD3 or FZD6 receptors.	SIGNOR-131084	wnt_myogenesis
WNT7A	PROTEIN	O00755	UNIPROT	MYOD1	PROTEIN	P15172	UNIPROT	Activates				9606;9606							9753670	NO		In explant cultures of mouse paraxial mesoderm, wnt1 induced expression of the mrf myf5, whereas wnt7a or wnt6 preferentially activated the mrf myod. Here we report that cells expressing wnt1 will preferentially activate myf5 while cells expressing wnt7a will preferentially activate myod	SIGNOR-50336	wnt_myogenesis
AXIN1	PROTEIN	O15169	UNIPROT	CTNNB1	PROTEIN	P35222	UNIPROT	Inactivates	Binding			9606;9606							10228155	YES		Axin, an inhibitor of the Wnt pathway, interacts with beta-catenin, GSK-3beta and APC and reduces the beta-catenin level. Phosphorylation by GSK3 kept Axin activated (open) for beta-catenin interaction and poised for engagement of LRP6.	SIGNOR-69460	wnt_myogenesis
GSK3B	PROTEIN	P49841	UNIPROT	CTNNB1	PROTEIN	P35222	UNIPROT	Inactivates	Phosphorylation	Ser37	YLDSGIHsGATTTAP	9606;9606							23151663	YES		Beta-catenin phosphorylation in vivo is sequentially carried out by two distinct kinases, CKIalfa and GSK-3. CKIalfa phosphorylation of S45 proceeds and is required for subsequent GSK-3 phosphorylation of T41, S37, and S33| One key substrate of GSK3 is the transcriptional co-activator beta catenin, whichis inactivated by GSK3 mediated phosphorylation and targeted for proteasomal degradation in unstimulated cells.	SIGNOR-70750	wnt_myogenesis
AXIN1	PROTEIN	O15169	UNIPROT	GSK3B	PROTEIN	P49841	UNIPROT	Inactivates	Binding			9606;9606							16293724	YES		We show that pge2 stimulates colon cancer cell growth through its heterotrimeric guanine nucleotide-binding protein (g protein)coupled receptor, ep2, by a signaling route that involves the activation of phosphoinositide 3-kinase and the protein kinase akt by free g protein bg subunits and the direct association of the g protein as subunit with the regulator of g protein signaling (rgs) domain of axin. This leads to the inactivation and release of glycogen synthase kinase 3b from its complex with axin, thereby relieving the inhibitory phosphorylation of b-catenin and activating its signaling pathway.	SIGNOR-83590	wnt_myogenesis
WNT3A	PROTEIN	P56704	UNIPROT	FZD3	PROTEIN	Q9NPG1	UNIPROT	Activates	Binding			9606;9606							21078818	YES		Ligands such as Wnt1, Wnt3a, and Wnt8 couple the seventransmembrane domain receptor Frizzled (Fzd) and the single-membrane-spanning low-density receptor-related protein 5/6 (LRP5/6) to activate Wntâb-catenin signaling.|All the Frizzled genes studied have a complex and partially overlapping pattern of expression in different regions of the embryo, and many of them (Fz1, 3, 7, 8 and 9) have specific expression in the epithelial somites as well as in the newly formed myotomes.	SIGNOR-131139	wnt_myogenesis
WNT3A	PROTEIN	P56704	UNIPROT	FZD1	PROTEIN	Q9UP38	UNIPROT	Activates	Binding			9606;9606							21078818	YES		Ligands such as Wnt1, Wnt3a, and Wnt8 couple the seventransmembrane domain receptor Frizzled (Fzd) and the single-membrane-spanning low-density receptor-related protein 5/6 (LRP5/6) to activate Wntâb-catenin signaling.|All the Frizzled genes studied have a complex and partially overlapping pattern of expression in different regions of the embryo, and many of them (Fz1, 3, 7, 8 and 9) have specific expression in the epithelial somites as well as in the newly formed myotomes.	SIGNOR-131118	wnt_myogenesis
RAC1	PROTEIN	P63000	UNIPROT	MAPK8	PROTEIN	P45983	UNIPROT	Activates	Binding			9606;9606							17251915	NO		The mechanism by which pak1 induced cancer growth might involve activation of jnk | in the non-canonical wnt pathway, frizzled uses galfaq or galfai and gbetagamma dimers to activate phospholipase c (plc), resulting in protein kinase c (pkc) activation and calcium mobilization that regulates the transcription factor nfat, and frizzled also signals through the small gtpases rho and rac to c-jun n-terminal kinase (jnk), which activates the ap1 transcription factor.	SIGNOR-78818	wnt_myogenesis
MAPK8	PROTEIN	P45983	UNIPROT	LRP6	PROTEIN	O75581	UNIPROT	Activates	Phosphorylation			9606;9606							20974802	YES		We show that several proline-directed mitogen-activated protein kinases (mapks), such as p38, erk1/2, and jnk1 are sufficient and required for the phosphorylation of ppps/tp motifs of lrp6. External stimuli, which control the activity of mapks, such as phorbol esters and fibroblast growth factor 2 (fgf2) control the choice of the lrp6-ppps/tp kinase and regulate the amplitude of lrp6 phosphorylation and wnt/beta-catenin-dependent transcription.	SIGNOR-25697	wnt_myogenesis
WNT3A	PROTEIN	P56704	UNIPROT	LRP6	PROTEIN	O75581	UNIPROT	Activates	Binding			9606;9606							15578921	YES		Here, we present evidence that lrp6 is internalized with caveolin and that the components of this endocytic pathway are required not only for wnt-3a-induced internalization of lrp6 but also for accumulation of beta-catenin.: Wnt proteins bind to the frizzled receptors and lrp5/6 co-receptors, and through stabilizing the critical mediator beta-catenin, initiate a complex signaling cascade that plays an important role in regulating cell proliferation and differentiation.	SIGNOR-25747	wnt_myogenesis
CREB1	PROTEIN	P16220	UNIPROT	MYOD1	PROTEIN	P15172	UNIPROT	Activates	Transcriptional activation			9606;9606							21902831	NO		Chen et al. showed that phosphorylated creb is present at high levels in cells of the dermomyotome that express pax3, myod and myf5 and that this phosphorylation is critical for the induction of these genes.	SIGNOR-50488	wnt_myogenesis
WNT1	PROTEIN	P04628	UNIPROT	FZD1	PROTEIN	Q9UP38	UNIPROT	Activates	Binding			9606;9606							15578921	YES		Wnt proteins bind to the frizzled receptors and lrp5/6 co-receptors, and through stabilizing the critical mediator beta-catenin, initiate a complex signaling cascade that plays an important role in regulating cell proliferation and differentiation.	SIGNOR-121534	wnt_myogenesis
GSK3B	PROTEIN	P49841	UNIPROT	AXIN1	PROTEIN	O15169	UNIPROT	Activates	Phosphorylation			9606;9606							9734785	YES		Axin, an inhibitor of the wnt pathway, interacts with beta-catenin, gsk-3beta and apc and reduces the beta-catenin level. Phosphorylation by gsk3 kept axin activated (open) for beta-catenin interaction and poised for engagement of lrp6.	SIGNOR-17196	wnt_myogenesis
RHOA	PROTEIN	P61586	UNIPROT	ROCK1	PROTEIN	Q13464	UNIPROT	Activates	Binding			9606;9606							8798490	YES		Rho-associated coiled-coil containing protein kinase 1 (rock1) is a key downstream effector of the small gtpase rhoa.	SIGNOR-100774	wnt_myogenesis
TRAF2	PROTEIN	Q12933	UNIPROT	MAP3K14	PROTEIN	Q99558	UNIPROT	Activates	Binding			9606;9606							9020361	YES		NIK binds to Traf2	SIGNOR-132450	nf-kb_non_canonical
TRAF2	PROTEIN	Q12933	UNIPROT	BIRC2	PROTEIN	Q13490	UNIPROT	Activates	Binding			9606;9606							18621737	YES		Through its death domain and amino-terminal region, tradd recruits rip1 (receptor-interacting protein), traf2, and through its interaction with traf2, c-iap1 and c-iap2.	SIGNOR-101347	nf-kb_non_canonical
BIRC2	PROTEIN	Q13490	UNIPROT	BIRC2	PROTEIN	Q13490	UNIPROT	Inactivates	Ubiquitination			9606;9606							14960576	YES		Ciap1 and ciap2 undergo autoubiquitination and degradation upon binding to the iap antagonist second mitochondrial activator of caspases (smac)/direct iap-binding protein with low pi (diablo), which is released from the mitochondria.	SIGNOR-101359	nf-kb_non_canonical
CHUK	PROTEIN	O15111	UNIPROT	MAP3K14	PROTEIN	Q99558	UNIPROT	Inactivates	Phosphorylation	Thr559	TGDYIPGtETHMAPE	9606;9606							20501937	YES		Upon activation by nik, ikkalfa phosphorylates nik, triggering its proteolysis.	SIGNOR-116951	nf-kb_non_canonical
LTB	PROTEIN	Q06643	UNIPROT	LTBR	PROTEIN	P36941	UNIPROT	Activates	Binding			9606;9606							7995952	YES		These experiments point toward the lt-alpha 1/beta 2 complex as the predominant membrane form of lt on the lymphocyte surface, and this complex is the primary ligand for the lt-beta receptor.	SIGNOR-73851	nf-kb_non_canonical
LTBR	PROTEIN	P36941	UNIPROT	TRAF3	PROTEIN	Q13114	UNIPROT	Activates	Binding			9606;9606							12571250	YES		Endogenous association of TRAF2, TRAF3, cIAP1, and Smac with lymphotoxin beta receptor reveals a novel mechanism of apoptosis.	SIGNOR-129599	nf-kb_non_canonical
BIRC2	PROTEIN	Q13490	UNIPROT	TRAF2	PROTEIN	Q12933	UNIPROT	Inactivates	Ubiquitination			9606;9606							18997794	YES		Traf3-binding receptors stabilize nik by activating ciap-dependent degradation of traf2 and traf3.	SIGNOR-98836	nf-kb_non_canonical
MAP3K14	PROTEIN	Q99558	UNIPROT	CHUK	PROTEIN	O15111	UNIPROT	Activates	Phosphorylation	Ser176	AKDVDQGsLCTSFVG	9606;9606							9520446	YES		Nf-kappab-inducing kinase activates ikk-alpha by phosphorylation of ser-176.|Nik preferentially phosphorylates ikk-alpha over ikk-beta, leading to the activation of ikk-alpha kinase activity; the accumulated nik phosphorylates ikkalfa.	SIGNOR-16392	nf-kb_non_canonical
LTBR	PROTEIN	P36941	UNIPROT	TRAF2	PROTEIN	Q12933	UNIPROT	Activates	Binding			9606;9606							12571250	YES		Endogenous association of TRAF2, TRAF3, cIAP1, and Smac with lymphotoxin beta receptor reveals a novel mechanism of apoptosis.	SIGNOR-129596	nf-kb_non_canonical
TNFRSF13C	PROTEIN	Q96RJ3	UNIPROT	TRAF3	PROTEIN	Q13114	UNIPROT	Activates	Binding			9606;9606							20889926	YES		Activation of BR3 induces recruitment and degradation of TRAF3.	SIGNOR-129603	nf-kb_non_canonical
CD40	PROTEIN	P25942	UNIPROT	TRAF2	PROTEIN	Q12933	UNIPROT	Activates	Binding			9606;9606							18635759	YES		Cd40, a tumor necrosis factor receptor (tnfr) family member, forms a complex containing adaptor molecules traf2 and traf3.	SIGNOR-98720	nf-kb_non_canonical
CD40LG	PROTEIN	P29965	UNIPROT	CD40	PROTEIN	P25942	UNIPROT	Activates	Binding			9606;9606							12324477	YES		Ramos cells were mixed with increasing numbers of transfected cells that expressed cd70 (cd27l) or cd154 (cd40l), both of which are expressed by activated t cells, in the presence of anti-igm ab. Cd27 ligation as well as cd40 ligation inhibited bcr-mediated apoptosis in a dose-dependent manner .cd40 binds its ligand cd40l.	SIGNOR-62521	nf-kb_non_canonical
TRAF2	PROTEIN	Q12933	UNIPROT	BIRC2	PROTEIN	Q13490	UNIPROT	Activates	Binding			9606;9606							18997792	YES		Through its death domain and amino-terminal region, tradd recruits rip1 (receptor-interacting protein), traf2, and through its interaction with traf2, c-iap1 and c-iap2.	SIGNOR-101353	nf-kb_non_canonical
TRAF3	PROTEIN	Q13114	UNIPROT	MAP3K14	PROTEIN	Q99558	UNIPROT	Inactivates	Binding			9606;9606							15084608	NO		Traf3 is physically associates with nik via a specific sequence motif located in the n-terminal region of nik; this molecular interaction appears to target nik for degradation by the proteasome.	SIGNOR-116909	nf-kb_non_canonical
CD40LG	PROTEIN	P29965	UNIPROT	CD40	PROTEIN	P25942	UNIPROT	Activates	Binding			9606;9606							19426221	YES		Ramos cells were mixed with increasing numbers of transfected cells that expressed cd70 (cd27l) or cd154 (cd40l), both of which are expressed by activated t cells, in the presence of anti-igm ab. Cd27 ligation as well as cd40 ligation inhibited bcr-mediated apoptosis in a dose-dependent manner .cd40 binds its ligand cd40l.	SIGNOR-62518	nf-kb_non_canonical
CHUK	PROTEIN	O15111	UNIPROT	NFKB2	PROTEIN	Q00653	UNIPROT	Activates	Phosphorylation	Ser866	TAEVKEDsAYGSQSV	9606;9606							15084608	YES		Ikkalfa phosphorylates p100, leading to its proteasomal processing to p52.	SIGNOR-92416	nf-kb_non_canonical
CHUK	PROTEIN	O15111	UNIPROT	NFKB2	PROTEIN	Q00653	UNIPROT	Activates	Phosphorylation	Ser870	KEDSAYGsQSVEQEA	9606;9606							15084608	YES		Ikkalfa phosphorylates p100, leading to its proteasomal processing to p52.	SIGNOR-92412	nf-kb_non_canonical
MAP3K14	PROTEIN	Q99558	UNIPROT	CHUK	PROTEIN	O15111	UNIPROT	Activates	Phosphorylation	Ser180	DQGSLCTsFVGTLQY	9606;9606							9520446	YES		Nik preferentially phosphorylates ikk-alpha over ikk-beta, leading to the activation of ikk-alpha kinase activity; the accumulated nik phosphorylates ikkalfa.	SIGNOR-16396	nf-kb_non_canonical
BIRC2	PROTEIN	Q13490	UNIPROT	TRAF2	PROTEIN	Q12933	UNIPROT	Inactivates	Ubiquitination			9606;9606							20651737	YES		Engagement of CD40 with its ligand CD40L results in the recruitment of the TRAF3Ã¢TRAF2Ã¢cIAP complex to the receptor. At the receptor, TRAF3 undergoes cIAP-dependent K48-linked polyubiquitylation (Ub) that targets it for proteasomal degradation. In the absence of TRAF3, NIK protein levels accumulate as it can no longer be recruited to the TRAF2Ã¢cIAP complex.	SIGNOR-129583	nf-kb_non_canonical
TRAF2	PROTEIN	Q12933	UNIPROT	MAP3K14	PROTEIN	Q99558	UNIPROT	Inactivates	Ubiquitination			9606;9606							20651737	YES		Under resting conditions cellular inhibitor of apoptosis (cIAP) proteins target nuclear factor-ÃºB (NF-ÃºB)-inducing kinase (NIK) for ubiquitylation and proteasomal degradation.	SIGNOR-129586	nf-kb_non_canonical
MAP3K14	PROTEIN	Q99558	UNIPROT	MAP3K14	PROTEIN	Q99558	UNIPROT	Activates	Phosphorylation			9606;9606							20651737	YES		As NIK levels increase, NIK presumably becomes activated by autophosphorylation (P).	SIGNOR-129589	nf-kb_non_canonical
TRAF2	PROTEIN	Q12933	UNIPROT	BIRC2	PROTEIN	Q13490	UNIPROT	Activates	Binding			9606;9606							8548810	YES		The c-IAPs associate with TRAF1 and TRAF3	SIGNOR-132166	nf-kb_non_canonical
TRAF2	PROTEIN	Q12933	UNIPROT	BIRC2	PROTEIN	Q13490	UNIPROT	Activates	Binding			9606;9606							18997794	YES		Through its death domain and amino-terminal region, tradd recruits rip1 (receptor-interacting protein), traf2, and through its interaction with traf2, c-iap1 and c-iap2.	SIGNOR-101350	nf-kb_non_canonical
NFKB2	PROTEIN	Q00653	UNIPROT	RELB	PROTEIN	Q01201	UNIPROT	Activates	Binding			9606;9606							19098713	YES		The MAP3K14-activated CHUK/IKKA homodimer phosphorylates NFKB2/p100 associated with RelB, inducing its proteolytic processing to NFKB2/p52 and the formation of NF-kappa-B RelB-p52 complexes. The NF-kappa-B heterodimeric RelB-p52 complex is a transcriptional activator.	SIGNOR-129663	nf-kb_non_canonical
